,id_str,hashtags,urls,text,clean_text,created_at,lang,quote_count,reply_count,retweet_count,favorite_count,to_cache,sa_label,sa
0,1249632254483202048,['nhs'],['https://twitter.com/i/web/status/1249632254483202048'],"""#NHS phone app holds key to lifting UK’s coronavirus lockdown. Mobiles will trace every contact of infected people"" : https://t.co/I0v436VnR3",NHS phone app holds key to lifting UK s coronavirus lockdown Mobiles will trace every contact of infected people,2020-04-13 09:35:21,en,0,0,0,0,True,negative,0.25305
1,1239651056818233345,"['hostileenvironment', 'covid']",['https://twitter.com/i/web/status/1239651056818233345'],"Today we demanded @patel4witham end the #HostileEnvironment during the #COVID19 crisis. @JCWI_UK, @libertyhq &amp; 30 more have joined the call for an end to NHS charging and data-sharing 

For the NHS to work it must be accesible to ALL

#PatientsNotPassports https://t.co/svJBbsXp1M https://t.co/WfJmrGmqDM",Today we demanded patelwitham end the HostileEnvironment during the COVID crisis JCWIUK libertyhq amp more have joined the call for an end to NHS charging and datasharing For the NHS to work it must be accesible to ALL PatientsNotPassports,2020-03-16 20:33:38,en,0,1,7,5,True,strongly_negative,0.14079999999999998
2,1241655838319788032,['london'],['https://twitter.com/i/web/status/1241655838319788032'],"#London: Free Balochistan Movement UK Branch announces to postpone its 27 March protest in London due to the #COVID_19 outbreak &amp; government’s advice to avoid large crowds. 

We urge FBM members to take part in the party’s online #PakistanQuitBalochistan campaign on 27 March 2020 https://t.co/KkLUA8tm8l",London Free Balochistan Movement UK Branch announces to postpone its March protest in London due to the COVID outbreak amp government s advice to avoid large crowds We urge FBM members to take part in the party s online PakistanQuitBalochistan campaign on March,2020-03-22 09:19:55,en,1,2,44,51,True,weakly_positive,0.61315
3,1241354538151444480,"['teleworkers', 'confidential', 'smartspeaker']",['https://twitter.com/i/web/status/1241354538151444480'],Say #teleworkers ever thought of that #confidential conversations with clients might be heard by your #smartspeaker ? Keep your private matters private !! - https://t.co/on1fs8d3In #infosec #cybersecurity #privacy @PrivacyPrivee @infosecsw #COVID19 #Coronavirus https://t.co/UP6LnP0i2n,Say teleworkers ever thought of that confidential conversations with clients might be heard by your smartspeaker Keep your private matters private infosec cybersecurity privacy PrivacyPrivee infosecsw COVID Coronavirus,2020-03-21 13:22:39,en,0,1,15,5,True,weakly_positive,0.5129
4,1248660363891150851,"['scotland', 'peak']",['https://twitter.com/i/web/status/1248660363891150851'],#Scotland April 10: It looks we are in a plateu more than in a #peak as data on new cases have been very similar since April 3. Is this the beginning of #FlattenTheCurve?Still uncertainty due to high daily variations in n.of tests. Better fit in coming days #NHSScotland #COVID19 https://t.co/XkQ3Pxqcwd,Scotland April It looks we are in a plateu more than in a peak as data on new cases have been very similar since April Is this the beginning of FlattenTheCurveStill uncertainty due to high daily variations in nof tests Better fit in coming days NHSScotland COVID,2020-04-10 17:13:24,en,0,1,2,5,True,positive,0.7294
5,1247486748420161536,['nhs'],['https://twitter.com/i/web/status/1247486748420161536'],Now more than ever it is crucial to alleviate additional pressure from the #NHS where possible. Digital technologies are key to supporting the ongoing needs of patients. Please check out our recent article on best practice prescribing during #COVID19 -  https://t.co/OGcogrVuk4 https://t.co/5Om9FgeVV2,Now more than ever it is crucial to alleviate additional pressure from the NHS where possible Digital technologies are key to supporting the ongoing needs of patients Please check out our recent article on best practice prescribing during COVID,2020-04-07 11:29:52,en,0,0,0,0,True,strongly_positive,0.901
6,1248247660680605697,['nhs'],['https://twitter.com/i/web/status/1248247660680605697'],"👀 @Quality_Watch will continue to monitor the latest #NHS performance data on urgent and emergency care, and planned care, over the coming months. During the coronavirus pandemic, these stats will become evermore important 📊",QualityWatch will continue to monitor the latest NHS performance data on urgent and emergency care and planned care over the coming months During the coronavirus pandemic these stats will become evermore important,2020-04-09 13:53:28,en,0,0,1,0,True,strongly_positive,0.8753
7,1243654784667856896,['coronalockdown'],['http://mycut.me/zRFD'],"Apple launches COVID-19 screening app

more: https://t.co/z9KAtaVNXf

#CoronaLockdown https://t.co/3eR0oG47IR",Apple launches COVID screening app more CoronaLockdown,2020-03-27 21:43:01,en,0,0,0,0,True,neutral,0.5
8,1249507438161772545,"['nhs', 'nationalhealthservice']","['https://u.fooo.ooo/post-25136/2020-4-12/UK-app-to-track-coronavirus-spread-to-be-launched', 'https://twitter.com/i/web/status/1249507438161772545']",[🔴 NEWS] UK app to track coronavirus spread to be launched https://t.co/TrmOwEI5lE #NHS #NationalHealthService #Privacy #Coronavirus #MattHancock #TheGuardian #DigitalTransformation #Outline #SourceCode #Ethics #Containment #China #Virus #Lockdown #HumanRightsCommission,NEWS UK app to track coronavirus spread to be launched NHS NationalHealthService Privacy Coronavirus MattHancock TheGuardian DigitalTransformation Outline SourceCode Ethics Containment China Virus Lockdown HumanRightsCommission,2020-04-13 01:19:22,en,0,0,0,0,True,weakly_positive,0.5640000000000001
9,1245733066712199174,"['nhs', 'coronavirus']",['https://twitter.com/i/web/status/1245733066712199174'],"More than ever, #NHS data must be opened up to combat the #coronavirus crisis | @JeniT/@ODIHQ https://t.co/Nz8OpDQs3p https://t.co/eojHjWGsfr",More than ever NHS data must be opened up to combat the coronavirus crisis JeniTODIHQ,2020-04-02 15:21:22,en,1,0,10,6,True,strongly_negative,0.12104999999999999
10,1239669498900369411,"['hostileenvironment', 'covid']",['https://twitter.com/i/web/status/1239669498900369411'],"Coronavirus must end the #HostileEnvironment!

Gov attempts to control #COVID19 &amp; protect public health are undermined by policies which stop undocumented migrants accessing healthcare.

Ministers must firewall NHS data from the Home Office immediately!

https://t.co/o9Tgt9eWDE",Coronavirus must end the HostileEnvironment Gov attempts to control COVID amp protect public health are undermined by policies which stop undocumented migrants accessing healthcare Ministers must firewall NHS data from the Home Office immediately,2020-03-16 21:46:55,en,0,0,19,24,True,weakly_negative,0.3634
11,1244383966179835904,"['nhs', 'covid']",['https://twitter.com/i/web/status/1244383966179835904'],"@jessphillips It would help the #NHS if we all self-reported. Help slow the spread of #COVID19 and identify at risk cases by self-reporting your symptoms daily, even if you feel well. Get the app and tell your friends https://t.co/tNR3la6sFP

#NHSHeroes #coronavirusuk #CoronavirusLockdownUK",jessphillips It would help the NHS if we all selfreported Help slow the spread of COVID and identify at risk cases by selfreporting your symptoms daily even if you feel well Get the app and tell your friends NHSHeroes coronavirusuk CoronavirusLockdownUK,2020-03-29 22:00:31,en,0,0,0,0,True,strongly_positive,0.9088
12,1247845393150418945,['london'],['https://twitter.com/i/web/status/1247845393150418945'],"#London's community &amp; voluntary sector needs more support, particularly from government, to work through the #COVID19 crisis.

@ben_rog argues the case in @centreforlondon’s latest blog post - read it below👇",Londons community amp voluntary sector needs more support particularly from government to work through the COVID crisis benrog argues the case in centreforlondon s latest blog post read it below,2020-04-08 11:15:00,en,0,0,1,3,True,negative,0.21355000000000002
13,1246932697588674566,"['stayathomeandstaysafe', 'socialdistancing', 'coronalockdown', 'coronavirus', 'covid']",['https://twitter.com/i/web/status/1246932697588674566'],#StayAtHomeAndStaySafe #SocialDistancing #CoronaLockdown #Coronavirus #COVID19 Check and listen now Today by Trace The Sidewalk @tracesidewalk on https://t.co/4zZsRPZYwX https://t.co/apuPoJjg75,StayAtHomeAndStaySafe SocialDistancing CoronaLockdown Coronavirus COVID Check and listen now Today by Trace The Sidewalk tracesidewalk on,2020-04-05 22:48:16,en,0,0,0,0,True,neutral,0.5
14,1240624255143985158,"['nhs', 'coviduk']",['https://twitter.com/i/web/status/1240624255143985158'],"Good news that mobile operators are removing data charges for accessing #NHS #covid19UK advice

Really important that people are getting the right information",Good news that mobile operators are removing data charges for accessing NHS covidUK advice Really important that people are getting the right information,2020-03-19 13:00:46,en,0,0,0,0,True,positive,0.71955
15,1247847556392026113,['nhs'],"['https://corona-help.uk/', 'https://twitter.com/i/web/status/1247847556392026113']","@carolkirkwood Today https://t.co/W6xNQSGCnE bot joined #NHS Apps Library. It makes real time access to national behavioural data on #socialdistancing &amp; #selfisolation effectiveness faster &amp; more efficient. DM for more info, to set up interviews etc #coronavirus #COVID19Pandemic",carolkirkwood Today bot joined NHS Apps Library It makes real time access to national behavioural data on socialdistancing amp selfisolation effectiveness faster amp more efficient DM for more info to set up interviews etc coronavirus COVIDPandemic,2020-04-08 11:23:35,en,0,0,0,0,True,positive,0.7377
16,1242429591932862464,"['covid', 'nhs', 'coronavirus', 'outlander', 'edinburgh', 'scotland', 'glasgow', 'aberdeen', 'dundee', 'london', 'photography']",['https://twitter.com/i/web/status/1242429591932862464'],"#COVID19 #NHS  #Coronavirus #Outlander #Edinburgh #Scotland #Glasgow #Aberdeen #Dundee #London #photography Help slow the spread of #COVID19 and identify at risk cases sooner by self-reporting your symptoms daily, even if you feel well. Download the app https://t.co/uY0VSZMIyd https://t.co/MY76XR4dh9",COVID NHS Coronavirus Outlander Edinburgh Scotland Glasgow Aberdeen Dundee London photography Help slow the spread of COVID and identify at risk cases sooner by selfreporting your symptoms daily even if you feel well Download the app,2020-03-24 12:34:32,en,0,0,0,0,True,positive,0.70095
17,1251346687160995841,"['belgium', 'france', 'europe', 'germany', 'uk', 'london', 'covid']",['https://twitter.com/i/web/status/1251346687160995841'],Wake up #Belgium #France #Europe #Germany #uk #London #Covid19 is being used to scare u into accepting their microchip vaccine that will forever violate your privacy and basic human rights and Freedom. Do not consent to forced vaccinatin !,Wake up Belgium France Europe Germany uk London Covid is being used to scare u into accepting their microchip vaccine that will forever violate your privacy and basic human rights and Freedom Do not consent to forced vaccinatin,2020-04-18 03:07:53,en,0,0,0,0,True,weakly_positive,0.64955
18,1244184358971478016,"['nhs', 'tech']",['https://twitter.com/i/web/status/1244184358971478016'],"The power of data in a pandemic - #NHS #Tech

Aggregating data from the NHS &amp; partners creates a real time operational view for evaluation of occupancy levels, capacity of A&amp;E &amp; waiting times plus statistics about #Covid-19 patients @NHSX

 #datamatters  https://t.co/Zdy4RtTkPo",The power of data in a pandemic NHS Tech Aggregating data from the NHS amp partners creates a real time operational view for evaluation of occupancy levels capacity of AampE amp waiting times plus statistics about Covid patients NHSX datamatters,2020-03-29 08:47:21,en,0,0,0,0,True,weakly_positive,0.6366
19,1250000949109837824,"['nhs', 'coronavirus', 'app', 'data', 'privacy']",['https://twitter.com/i/web/status/1250000949109837824'],"Our very own @Richbate on @BBCScotlandNews talking about the new #NHS #coronavirus tracking #app and #data #privacy - and natural in front of the camera! 
#MobileApps ##Mobile #AppDev #Digital #Innovation #Healthcare #Health #Cybersecurity @WaracleUK https://t.co/D8X88QOXBn",Our very own Richbate on BBCScotlandNews talking about the new NHS coronavirus tracking app and data privacy and natural in front of the camera MobileApps Mobile AppDev Digital Innovation Healthcare Health Cybersecurity WaracleUK,2020-04-14 10:00:24,en,0,0,0,0,True,strongly_positive,0.81245
20,1250433104600117249,['thankyou'],['https://twitter.com/i/web/status/1250433104600117249'],"Huge thank you to @SustainableEvnt for organizing the first session of the Hackathon Event Industry Reset
#ThankYou #sustainability #foodwaste #ClimateChange #covid19 #April2020 #sustainableeventalliance #thinkthank #Inspiration https://t.co/1NhrLUayqc",Huge thank you to SustainableEvnt for organizing the first session of the Hackathon Event Industry Reset ThankYou sustainability foodwaste ClimateChange covid April sustainableeventalliance thinkthank Inspiration,2020-04-15 14:37:38,en,0,0,0,0,True,strongly_positive,0.901
21,1242007050235887616,"['covid', 'genomics', 'nhs']",['https://twitter.com/i/web/status/1242007050235887616'],"The #Covid-19 #Genomics UK Consortium, a collaboration between the #NHS, public health agencies and the Wellcome Sanger Institute universities is tracking #genetic mutations in the #virus to build understanding of this #pandemic - https://t.co/gM1ztNjmCz.",The Covid Genomics UK Consortium a collaboration between the NHS public health agencies and the Wellcome Sanger Institute universities is tracking genetic mutations in the virus to build understanding of this pandemic,2020-03-23 08:35:30,en,0,0,0,0,True,neutral,0.5
22,1245066467835551746,"['coronavirus', 'coronavirustruth', 'coronaconspiracy', 'coronalockdown', 'coronaviruslockdownuk']",['https://www.bbc.co.uk/news/technology-52095331'],"#Coronavirus #Coronavirustruth #Coronaconspiracy #CoronaLockdown #CoronavirusLockdownUK 

More like tracking you!!!

https://t.co/kQpeCMkPOw",Coronavirus Coronavirustruth Coronaconspiracy CoronaLockdown CoronavirusLockdownUK More like tracking you,2020-03-31 19:12:32,en,0,0,0,0,True,positive,0.71005
23,1249248543728164867,"['nhs', 'uk', 'coronavirus', 'covid', 'covid']",['https://twitter.com/i/web/status/1249248543728164867'],"#NHS #UK #coronavirus #COVID19 Help slow the spread of #COVID19 and identify at risk cases sooner by self-reporting your symptoms daily, even if you feel well  🙏. Download the app https://t.co/LHlAtqcykq",NHS UK coronavirus COVID Help slow the spread of COVID and identify at risk cases sooner by selfreporting your symptoms daily even if you feel well Download the app,2020-04-12 08:10:37,en,0,0,1,0,True,positive,0.70095
24,1243613763728805889,"['coronalockdown', 'covid']",['https://twitter.com/i/web/status/1243613763728805889'],"#CoronaLockdown | It is important to disinfect your laptop and smartphone at the workplace.  #Covid19

Here's how you can clean your smartphone and laptop within 2 minutes. 

https://t.co/DYAle4WzSi",CoronaLockdown It is important to disinfect your laptop and smartphone at the workplace Covid Heres how you can clean your smartphone and laptop within minutes,2020-03-27 19:00:01,en,0,0,3,3,True,positive,0.77115
25,1247109343121719298,"['scottish', 'government', 'covid', 'scotland']",['https://twitter.com/i/web/status/1247109343121719298'],"Ian Watt at @codethecity is using #Scottish #Government open data to track #COVID19 cases across #Scotland. Read about his important work here. @watty62 
https://t.co/EjYJixk97p",Ian Watt at codethecity is using Scottish Government open data to track COVID cases across Scotland Read about his important work here watty,2020-04-06 10:30:12,en,0,0,1,1,True,weakly_positive,0.60115
26,1241039422319218690,"['messaging', 'conferencing', 'nhs']",['https://twitter.com/i/web/status/1241039422319218690'],"⚕️ @MicrosoftTeams #Messaging and #Conferencing App will be available for FREE across the #NHS, to Counter the Risks associated with #Coronavirus / #COVID19

🖥️ https://t.co/09hqHFOdYT

@NHSDigital @HIMSS

@HubBucket @HubDevOps

@HubDataOps @HubAPIs

@HubIoMT @HubBucketEdge https://t.co/uYPp7INtU7",MicrosoftTeams Messaging and Conferencing App will be available for FREE across the NHS to Counter the Risks associated with Coronavirus COVID NHSDigital HIMSS HubBucket HubDevOps HubDataOps HubAPIs HubIoMT HubBucketEdge,2020-03-20 16:30:30,en,0,0,4,4,True,positive,0.7233
27,1242562019284398086,"['nhs', 'mentalhealthmatters']",['https://work.headspace.com/nhs-clinical/member-enroll'],@Headspace are giving #NHS staff access to their app for free until the end of December 2020. #MentalHealthMatters  https://t.co/d5W6TTsIQF,Headspace are giving NHS staff access to their app for free until the end of December MentalHealthMatters,2020-03-24 21:20:45,en,0,0,0,0,True,strongly_positive,0.8453999999999999
28,1243128282020749312,"['medtech', 'nhs']",['https://twitter.com/i/web/status/1243128282020749312'],"SEHTA has complied a catalogue of offers from #medtech companies, who can offer support by supplying the #NHS, with #Ventilators, #Respirators, #PPE, #Screening, #Monitoring, #DigitalHealthTech - Download your copy 👉https://t.co/tWhk6ZPDm8 https://t.co/c0K1ShDvT1",SEHTA has complied a catalogue of offers from medtech companies who can offer support by supplying the NHS with Ventilators Respirators PPE Screening Monitoring DigitalHealthTech Download your copy,2020-03-26 10:50:53,en,0,0,0,1,True,positive,0.70095
29,1249570661611130880,"['apps', 'coronavirusoutbreak', 'matthancock', 'nhs']",['https://iandroid.eu/uk-app-to-track-coronavirus-spread-to-be-launched/'],UK app to trace coronavirus unfold to be introduced #Apps #CoronavirusOutbreak #MattHancock #NHS https://t.co/GseI4HQYoO,UK app to trace coronavirus unfold to be introduced Apps CoronavirusOutbreak MattHancock NHS,2020-04-13 05:30:36,en,0,0,0,0,True,neutral,0.5
30,1251600643959271424,"['photography', 'coronalockdown', 'globalwarming']",['https://twitter.com/i/web/status/1251600643959271424'],Looking good on #photography stressful #CoronaLockdown  brought reversal of #GlobalWarming brings joy &amp; fun like #lol but confinement is neded to stop #coronavirus Voluntary #lockdown is even better. Indian PM Modi did it https://t.co/FswPxaOept Can it aid https://t.co/BJ2jbvuWLw,Looking good on photography stressful CoronaLockdown brought reversal of GlobalWarming brings joy amp fun like lol but confinement is neded to stop coronavirus Voluntary lockdown is even better Indian PM Modi did it Can it aid,2020-04-18 19:57:01,en,0,0,0,0,True,strongly_positive,0.8967499999999999
31,1247869538265436164,['nhs'],['https://twitter.com/i/web/status/1247869538265436164'],Support flooding in for us Thanks @VodafoneUK who has just donated data free to @spencer_mcbride phone and the #NHS backing Including from  @ELHT_NHS and @LancsHospitals @PDKinetics @BBCNews @DailyMirror @GranadaReports,Support flooding in for us Thanks VodafoneUK who has just donated data free to spencermcbride phone and the NHS backing Including from ELHTNHS and LancsHospitals PDKinetics BBCNews DailyMirror GranadaReports,2020-04-08 12:50:56,en,1,1,3,6,True,strongly_positive,0.9200999999999999
32,1251064785082486789,"['coronavirus', 'nhs', 'technology']",['https://www.bbc.co.uk/news/technology-52294896'],"#Coronavirus #NHS contact tracing app to target 80% of smartphone users 
#technology  https://t.co/WAVRnipAar",Coronavirus NHS contact tracing app to target of smartphone users technology,2020-04-17 08:27:43,en,0,0,0,0,True,neutral,0.5
33,1240149757286322177,"['mobilephone', 'o', 'nhs']",['https://twitter.com/i/web/status/1240149757286322177'],Considering @NHSDigital work #mobilephone's are on the @O2 network. I'd hope #o2 would make access to #NHS &amp; @NHSuk websites free of #data charges for their #mobilephone #customers. Its vital #people read accurate #medical #information during these worrying times of #COVID19.,Considering NHSDigital work mobilephones are on the O network Id hope o would make access to NHS amp NHSuk websites free of data charges for their mobilephone customers Its vital people read accurate medical information during these worrying times of COVID,2020-03-18 05:35:17,en,0,0,0,0,True,positive,0.7997000000000001
34,1247153872407343104,"['digital', 'nhs', 'app']",['https://twitter.com/i/web/status/1247153872407343104'],The #digital arm of the #NHS is working on a contact tracing #app which would notify people if they have come into close contact with someone who later tests positive for #coronavirus - so they can quickly self-isolate before passing it on to many people.,The digital arm of the NHS is working on a contact tracing app which would notify people if they have come into close contact with someone who later tests positive for coronavirus so they can quickly selfisolate before passing it on to many people,2020-04-06 13:27:08,en,0,0,0,0,True,positive,0.7787
35,1240180320806277120,"['creative', 'chromavid', 'chromakey', 'photos', 'videos']",['https://twitter.com/i/web/status/1240180320806277120'],"Bored at home? Why not do something #Creative? 
Use #Chromavid App to create amazing #Chromakey #photos and #Videos. Just grab a green background and get
Go to places without leaving you home. 😉
https://t.co/cBgPV8qygF #Chroma #greenscreen #Covid19 #coronavirus #Boredathome https://t.co/A7zNaKVvyk",Bored at home Why not do something Creative Use Chromavid App to create amazing Chromakey photos and Videos Just grab a green background and get Go to places without leaving you home Chroma greenscreen Covid coronavirus Boredathome,2020-03-18 07:36:44,en,0,0,0,0,True,weakly_positive,0.66935
36,1249726406134845447,['photography'],['https://ift.tt/2JYbSjB'],"""BCN data shows mirrorless camera sales have dropped 50% YoY for March amidst COVID-19 pandemic"" https://t.co/F8lLlbsDx8 #photography",BCN data shows mirrorless camera sales have dropped YoY for March amidst COVID pandemic photography,2020-04-13 15:49:28,en,0,0,0,0,True,neutral,0.5
37,1248344907355308033,['globalwarming'],['https://twitter.com/i/web/status/1248344907355308033'],"#Globalwarming is quickly destroying natural habitats. This forces the wild animals (eg bats) into closer proximity w humans making it easier for the animal viruses (zoological viruses,) to cross over into humans. This has happened with the #Covid19 #virus. | #Climageddon",Globalwarming is quickly destroying natural habitats This forces the wild animals eg bats into closer proximity w humans making it easier for the animal viruses zoological viruses to cross over into humans This has happened with the Covid virus Climageddon,2020-04-09 20:19:53,en,0,0,0,0,True,weakly_positive,0.58895
38,1248275915488088064,"['data', 'nhs', 'tv', 'fullfibre']",['https://twitter.com/i/web/status/1248275915488088064'],"Unlimited mobile #data for #NHS staff from @EE, more free #TV from @virginmedia and still expanding #fullfibre from #altnets - todays' #ConnectedBritain daily updates from @totaltelecom ahead of #EasterAtHome 🇬🇧
https://t.co/MAP58LgEFy 
#coronavirus",Unlimited mobile data for NHS staff from EE more free TV from virginmedia and still expanding fullfibre from altnets todays ConnectedBritain daily updates from totaltelecom ahead of EasterAtHome coronavirus,2020-04-09 15:45:44,en,0,0,0,0,True,positive,0.77815
39,1249532825763790848,"['nhs', 'privacy']",['https://www.theguardian.com/world/2020/apr/12/uk-government-using-confidential-patient-data-in-coronavirus-response'],"#NHS #privacy
Government never roll back.. Once genie is out the bottle. 
https://t.co/XAQWTkBp0A",NHS privacy Government never roll back Once genie is out the bottle,2020-04-13 03:00:15,en,0,0,1,1,True,neutral,0.5
40,1243592377102557184,"['coronalockdown', 'climatestrike']",['https://twitter.com/i/web/status/1243592377102557184'],"We are locked down in our homes amidst #CoronaLockdown
but for now the #ClimateStrike movement is digital..
The planet seems to be healing as the polluters go on a break.
#FridaysForFuture
#DigitalStrike 
#lockdown 
#ClimateCrisis 
#CoronaLockdown 
@Fridays4future 
@vanessa_vash",We are locked down in our homes amidst CoronaLockdown but for now the ClimateStrike movement is digital The planet seems to be healing as the polluters go on a break FridaysForFuture DigitalStrike lockdown ClimateCrisis CoronaLockdown Fridaysfuture vanessavash,2020-03-27 17:35:02,en,0,0,7,8,True,strongly_negative,0.19379999999999997
41,1250717148328144896,"['nhs', 'covid']",[],"Test - Treat - Trace. WHO.
anything else is political bullshit costing us our lives.
#NHS #COVID19",Test Treat Trace WHO anything else is political bullshit costing us our lives NHS COVID,2020-04-16 09:26:20,en,0,0,0,0,True,weakly_negative,0.3634
42,1243200857828720645,"['nhs', 'covid']",['https://twitter.com/i/web/status/1243200857828720645'],"RT billfreehomes ""RT durham_uni ""Big thank you to all the #NHS workers getting us through #COVID19 💜

To do their bit, some of our researchers are helping NHS Trusts analyse patient data, allowing the medics to identify &amp; treat patients at risk more … https://t.co/GFT0GvfZUo""""",RT billfreehomes RT durhamuni Big thank you to all the NHS workers getting us through COVID To do their bit some of our researchers are helping NHS Trusts analyse patient data allowing the medics to identify amp treat patients at risk more,2020-03-26 15:39:16,en,0,0,0,0,True,strongly_positive,0.9063
