,id_str,hashtags,urls,text,clean_text,created_at,lang,quote_count,reply_count,retweet_count,favorite_count,to_cache,sa_label,sa
88,1242211158012067841,"['nhs', 'covid', 'innovation', 'technology']",['https://twitter.com/i/web/status/1242211158012067841'],.#NHS Cash available for #COVID19 #innovation! New #technology challenge to support those who are isolating  https://t.co/4RpVpbta3l @thehivesouthend @enterprise4good @markkass @businessonsea @SouthendTech  @TechEastUK @EssexChambers @BBCLookEast @BBCEssex  #Hackathon #COVIDー19,NHS Cash available for COVID innovation New technology challenge to support those who are isolating thehivesouthend enterprisegood markkass businessonsea SouthendTech TechEastUK EssexChambers BBCLookEast BBCEssex Hackathon COVIDー,2020-03-23 22:06:33,en,0,0,4,3,True,strongly_positive,0.8404
89,1249766399003803650,"['nhs', 'coronavirus', 'facepalm']",['https://www.theguardian.com/world/2020/apr/13/nhs-coronavirus-app-memo-discussed-giving-ministers-power-to-de-anonymise-users?CMP=Share_AndroidApp_TwitPane'],"#NHS #coronavirus app: memo discussed giving ministers power to 'de-anonymise' users
 #facepalm 
https://t.co/Vsjd67BNq9",NHS coronavirus app memo discussed giving ministers power to deanonymise users facepalm,2020-04-13 18:28:23,en,0,0,0,0,True,weakly_positive,0.67
90,1251184531207524360,['nhs'],['https://twitter.com/i/web/status/1251184531207524360'],"@BorisJohnson Public #NHS keep their part of the deal.  What of you PM? 5 March 2020 Hancock classified Covid19 as-notifiable disease requiring certain legal obs i.e testing, monitoring et al https://t.co/agTaB4XtBA it's not just for recording deaths IT'S TO PREVENT DEATHS! Hope implemented?",BorisJohnson Public NHS keep their part of the deal What of you PM March Hancock classified Covid asnotifiable disease requiring certain legal obs ie testing monitoring et al its not just for recording deaths ITS TO PREVENT DEATHS Hope implemented,2020-04-17 16:23:32,en,0,0,0,0,True,strongly_positive,0.8728
91,1251072990382632961,['edinburgh'],['https://twitter.com/i/web/status/1251072990382632961'],#Edinburgh tech firm @neatebox is offering supermarkets across the UK access to its 'Welcome' app to help disabled shoppers during the #COVID19 lockdown. https://t.co/BHQkFbMfcH,Edinburgh tech firm neatebox is offering supermarkets across the UK access to its Welcome app to help disabled shoppers during the COVID lockdown,2020-04-17 09:00:19,en,0,1,1,1,True,strongly_positive,0.8453999999999999
92,1242074128124952576,"['covid', 'nhs']",['https://www.neowin.net/news/experts-nhs-covid-19-tracking-app-should-respect-privacy'],Experts: NHS' COVID-19 tracking app should respect privacy #Covid19 #NHS https://t.co/rwLPH2JW7s https://t.co/tDaqwIatz0,Experts NHS COVID tracking app should respect privacy Covid NHS,2020-03-23 13:02:03,en,0,0,1,0,True,positive,0.7383500000000001
93,1249416355545260034,['nhs'],['https://twitter.com/i/web/status/1249416355545260034'],"Matt Hancock has confirmed plans for the #NHS to launch a contact tracing app.

The tech tells users if they've been in close proximity to someone who has tested positive for the #coronavirus…

@_hasanc has more here: https://t.co/NCkQqSjdPM https://t.co/1wOClWlTDq",Matt Hancock has confirmed plans for the NHS to launch a contact tracing app The tech tells users if theyve been in close proximity to someone who has tested positive for the coronavirus hasanc has more here,2020-04-12 19:17:26,en,0,0,1,0,True,positive,0.7787
94,1243159960327987200,"['scotland', 'salmon']",['https://twitter.com/i/web/status/1243159960327987200'],"#Scotland has relaxed rules around #salmon farm monitoring, fallow periods, and biomass limits, while stressing environmental impacts must be limited as far as possible: #coronavirus

 https://t.co/500DCSreXV",Scotland has relaxed rules around salmon farm monitoring fallow periods and biomass limits while stressing environmental impacts must be limited as far as possible coronavirus,2020-03-26 12:56:45,en,0,0,1,0,True,weakly_negative,0.4742
95,1245293895384043520,"['followformore', 'videos', 'tech']","['https://eleccafe.com/2020/04/01/this-smart-ring-may-detect-early-signs-of-coronavirus/', 'https://twitter.com/i/web/status/1245293895384043520']",This smart ring may detect early signs of coronavirus - #followForMore #videos - https://t.co/gcf5CG48Fj - #Tech #Technology #Web #App #mobile #gaming #eleccafe https://t.co/ZSZc6gKA9x,This smart ring may detect early signs of coronavirus followForMore videos Tech Technology Web App mobile gaming eleccafe,2020-04-01 10:16:15,en,0,0,0,0,True,positive,0.70095
96,1251204080380391426,"['uk', 'confidential', 'data', 'coronavirus']",['https://www.theguardian.com/world/2020/apr/12/uk-government-using-confidential-patient-data-in-coronavirus-response?CMP=share_btn_tw'],#UK government using #confidential patient #data in #coronavirus response https://t.co/my3acnazeb,UK government using confidential patient data in coronavirus response,2020-04-17 17:41:13,en,0,0,0,0,True,neutral,0.5
97,1245277577855590400,"['covid', 'nhs']",['https://twitter.com/i/web/status/1245277577855590400'],Visualising deaths in hospital from #covid19 across #nhs Thanks to @hsj for sourcing and sharing the data. https://t.co/xyxffmZv6e https://t.co/MlpV1yIUuz,Visualising deaths in hospital from covid across nhs Thanks to hsj for sourcing and sharing the data,2020-04-01 09:11:25,en,0,1,3,0,True,strongly_positive,0.8453999999999999
98,1248308622662254592,['scotland'],['https://covid19.tobystrong.me/'],Today's data is now available on my #Scotland COVID-19 tracker https://t.co/DR3Isgvd6x,Todays data is now available on my Scotland COVID tracker,2020-04-09 17:55:42,en,0,0,0,0,True,neutral,0.5
99,1245361255872958465,"['lewishamhospital', 'nhs']",['https://twitter.com/i/web/status/1245361255872958465'],@YouTube Hi 👋 we are a voluntary organisation helping to support #LewishamHospital #NHS staff during the #Coronavirus crisis. Can we get a custom YouTube domain?,YouTube Hi we are a voluntary organisation helping to support LewishamHospital NHS staff during the Coronavirus crisis Can we get a custom YouTube domain,2020-04-01 14:43:55,en,0,0,0,0,True,weakly_negative,0.4742
100,1247807340243374086,['nhs'],['https://twitter.com/i/web/status/1247807340243374086'],"“We trust @Uber to know everywhere we go, we trust @gmail with everything we write. If we don’t trust the #NHS with our health #data then who do we trust?"" says @vitt61 #Tracking #Covid_19 @ftbrussels https://t.co/ZhvsikRkMN",We trust Uber to know everywhere we go we trust gmail with everything we write If we don t trust the NHS with our health data then who do we trust says vitt Tracking Covid ftbrussels,2020-04-08 08:43:47,en,0,0,0,0,True,strongly_positive,0.96085
101,1244942664056872962,"['nhs', 'covid', 'qaurantine']",['https://twitter.com/i/web/status/1244942664056872962'],Stay home stay safe #NHS #COVID19 #qaurantine....working on Helping Hand App soon out NHS &amp; Health workers I got u... https://t.co/Twc4s2EB3c,Stay home stay safe NHS COVID qaurantineworking on Helping Hand App soon out NHS amp Health workers I got u,2020-03-31 11:00:35,en,0,0,0,0,True,strongly_positive,0.9037
102,1245620829137727491,['london'],['https://twitter.com/i/web/status/1245620829137727491'],"Air pollution in #London falls dramatically since the coronavirus lockdown was implemented last week, says London Air Quality Network. Average pollution levels now at their lowest since recordings began in 2000. Scientists studying the data suggest it could shape future advice",Air pollution in London falls dramatically since the coronavirus lockdown was implemented last week says London Air Quality Network Average pollution levels now at their lowest since recordings began in Scientists studying the data suggest it could shape future advice,2020-04-02 07:55:22,en,0,0,0,0,True,weakly_negative,0.30910000000000004
103,1251867830611578880,"['hostileenvironment', 'covid', 'nhs']",['https://twitter.com/i/web/status/1251867830611578880'],"The #HostileEnvironment in healthcare means some migrants with #covid19 symptoms are scared to seek #NHS treatment.

The Govt must stop charging migrants and sharing their data with @ukhomeoffice, then publicise this change to make sure all come forward. https://t.co/aEhPaMxTXt",The HostileEnvironment in healthcare means some migrants with covid symptoms are scared to seek NHS treatment The Govt must stop charging migrants and sharing their data with ukhomeoffice then publicise this change to make sure all come forward,2020-04-19 13:38:44,en,0,0,2,1,True,neutral,0.5
104,1247644148183764998,"['scotland', 'covid']",[],"Well, just finished all my evening phone calls in #Scotland, I have a list of folks I call during #COVID19 Just a wee bit of voluntary work",Well just finished all my evening phone calls in Scotland I have a list of folks I call during COVID Just a wee bit of voluntary work,2020-04-07 21:55:19,en,0,0,0,0,True,weakly_positive,0.6366
105,1247846193176236039,['nhs'],"['https://corona-help.uk/', 'https://twitter.com/i/web/status/1247846193176236039']","@dave_harfield Today https://t.co/W6xNQSGCnE bot joined #NHS Apps Library. It makes real time access to national behavioural data on #socialdistancing &amp; #selfisolation effectiveness faster &amp; more efficient. DM for more info, to set up interviews etc #coronavirus #COVID19Pandemic",daveharfield Today bot joined NHS Apps Library It makes real time access to national behavioural data on socialdistancing amp selfisolation effectiveness faster amp more efficient DM for more info to set up interviews etc coronavirus COVIDPandemic,2020-04-08 11:18:10,en,0,0,0,0,True,positive,0.7377
106,1250348166320283649,"['ku', 'government', 'nhs', 'covid', 'app', 'tracking']",['https://www.governmentcomputing.com/health/news/nhs-covid-19-contact-tracing-app'],"UK govt set to launch NHS COVID-19 contact tracing app https://t.co/oMzTCO4rT7
#KU #government #NHS #COVID19 #app #tracking",UK govt set to launch NHS COVID contact tracing app KU government NHS COVID app tracking,2020-04-15 09:00:07,en,0,0,0,0,True,neutral,0.5
107,1247435155553255424,"['covid', 'nhs']",['https://twitter.com/i/web/status/1247435155553255424'],"New report. UK #COVID19 data.
First 2204 patients admitted to 286 #NHS ICUs. From @ICNARC
Mean age 60
93% independent
73% overweight/obese
73% male
35% not white
Mean stay 5 days
95% respiratory
20% needed renal support
50% survivors
Huge work.
https://t.co/0bTGGSHI1f",New report UK COVID data First patients admitted to NHS ICUs From ICNARC Mean age independent overweightobese male not white Mean stay days respiratory needed renal support survivors Huge work,2020-04-07 08:04:51,en,0,0,0,0,True,strongly_positive,0.82985
108,1249234612716548097,"['nhs', 'chinese']",['https://twitter.com/i/web/status/1249234612716548097'],"@ShippersUnbound @thesundaytimes it wouldn’t be the #NHS app. This is a #Chinese app for spying on citizens . they’ve got another thing coming if they want access to my phone,contacts and call history.can either get enough #tests or I’ll wait till I know I need one.  #covid-19 https://t.co/IIGkQLzFpx",ShippersUnbound thesundaytimes it wouldn t be the NHS app This is a Chinese app for spying on citizens they ve got another thing coming if they want access to my phonecontacts and call historycan either get enough tests or I ll wait till I know I need one covid,2020-04-12 07:15:15,en,0,0,0,0,True,weakly_positive,0.5386
109,1242783155272265732,"['coviduk', 'covid', 'nhs']",['https://www.digitalhealth.net/2020/03/kings-college-london-covid-19-app/'],"Kings College London launches Covid-19 symptom reporting app 

https://t.co/OoTt5MY531 #covid19UK #COVID19 #NHS",Kings College London launches Covid symptom reporting app covidUK COVID NHS,2020-03-25 11:59:28,en,0,0,0,0,True,neutral,0.5
110,1243534849324896258,"['coronavirus', 'coronalockdown']",['https://twitter.com/i/web/status/1243534849324896258'],"Don’t keep your mobile phone and handkerchief in the same trouser pocket
#coronavirus #CoronaLockdown #CoronavirusOutbreak #COVID #StayAwareStaySafe #lockdownindia https://t.co/deT4YacjmU",Don t keep your mobile phone and handkerchief in the same trouser pocket coronavirus CoronaLockdown CoronavirusOutbreak COVID StayAwareStaySafe lockdownindia,2020-03-27 13:46:26,en,0,0,0,0,True,neutral,0.5
111,1247172247472742403,"['scotland', 'covid']",[],"Missed this from today's #Scotland #covid19 data

Number of daily tests per day up to yesterday. What a drop. https://t.co/w5WYjHIzJF",Missed this from todays Scotland covid data Number of daily tests per day up to yesterday What a drop,2020-04-06 14:40:09,en,0,0,0,0,True,negative,0.2706
112,1248572147871727616,"['podcast', 'fitlabpgh', 'movementisalifestyle', 'movement', 'videos']",['https://twitter.com/i/web/status/1248572147871727616'],"#podcast #FitLabPGH #movementisalifestyle bringing #movement tip/lifestyle hack #videos - keep moving at a #safedistance #thankfulness #selfawareness during #covid19 #socialdistancing and #stayathome
https://t.co/PW5iV3MLJH https://t.co/99RiF2H58m",podcast FitLabPGH movementisalifestyle bringing movement tiplifestyle hack videos keep moving at a safedistance thankfulness selfawareness during covid socialdistancing and stayathome,2020-04-10 11:22:52,en,0,0,1,0,True,positive,0.7383500000000001
113,1244473351466254337,"['furry', 'furrymeme', 'covid', 'covid', 'wtf', 'memes', 'coronalockdown']",[],"Am the only furry on this app that post memes #furry #furrymeme
#Covid_19 #COVID19 #wtf #memes #CoronaLockdown",Am the only furry on this app that post memes furry furrymeme Covid COVID wtf memes CoronaLockdown,2020-03-30 03:55:42,en,0,0,0,0,True,negative,0.20705
114,1250791193992101888,"['wearyourmasks', 'covid', 'photography', 'videos']",['https://twitter.com/i/web/status/1250791193992101888'],"#WearYourMasks #COVID19 requires #
Stimulate your brains and learn more about #Photography and making #videos on smartphone via the #BonCitoyen229 App available here https://t.co/kpEalKDkDV. https://t.co/Mkza4ToOEw",WearYourMasks COVID requires Stimulate your brains and learn more about Photography and making videos on smartphone via the BonCitoyen App available here,2020-04-16 14:20:33,en,0,0,2,2,True,weakly_positive,0.61315
115,1246016585363533824,"['nhs', 'covid', 'publichealth']",['https://twitter.com/i/web/status/1246016585363533824'],"The data below shows the shift in roles of #NHS primary care providers since #COVID19.

#PublicHealth services have been almost entirely stopped or heavily reduced. Although, we know childhood immunisations are continuing, will there be a public health deficit after the epidemic? https://t.co/HCvXc9JPHy",The data below shows the shift in roles of NHS primary care providers since COVID PublicHealth services have been almost entirely stopped or heavily reduced Although we know childhood immunisations are continuing will there be a public health deficit after the epidemic,2020-04-03 10:07:58,en,0,0,0,0,True,weakly_negative,0.44675
116,1245244801492156422,"['film', 'media', 'smartphone', 'scotland']",['https://nofilmschool.com/corona-changes-tv-writing'],How is Coronavirus Changing TV Pilot and Staffing Season? #film #media #smartphone #scotland https://t.co/miI43Rm1pe,How is Coronavirus Changing TV Pilot and Staffing Season film media smartphone scotland,2020-04-01 07:01:10,en,0,0,0,0,True,neutral,0.5
117,1243577573147377665,"['coronavirus', 'coronalockdown']",['https://twitter.com/w7voa/status/1243572625118392321?s=21'],@Apple’s new App. #coronavirus #CoronaLockdown https://t.co/iQob2sQztk,Apple s new App coronavirus CoronaLockdown,2020-03-27 16:36:12,en,0,0,0,0,True,neutral,0.5
118,1244748787014225921,"['housepartyhack', 'coronavirus', 'coronalockdown']",[],"Change the registered email, delete the app and then wash your hands! #housepartyhack #coronavirus #CoronaLockdown",Change the registered email delete the app and then wash your hands housepartyhack coronavirus CoronaLockdown,2020-03-30 22:10:11,en,0,0,0,0,True,neutral,0.5
119,1249592940567150592,"['london', 'glasgow', 'edinburgh', 'manchester', 'uk', 'confidential']",['https://twitter.com/i/web/status/1249592940567150592'],"#London- #Glasgow #Edinburgh #Manchester From those @guardian :

#UK government using #confidential patient data in #coronavirus response
 https://t.co/DyYiL6PR8X",London Glasgow Edinburgh Manchester From those guardian UK government using confidential patient data in coronavirus response,2020-04-13 06:59:08,en,0,0,1,0,True,neutral,0.5
120,1250696390960992257,"['nhs', 'coronavirusuk', 'covid']",['https://twitter.com/i/web/status/1250696390960992257'],"#NHS #coronavirusuk Help slow the spread of #COVID19 and identify at risk cases sooner by self-reporting your symptoms daily, even if you feel well  🙏. Download the app https://t.co/LHlAtqcykq",NHS coronavirusuk Help slow the spread of COVID and identify at risk cases sooner by selfreporting your symptoms daily even if you feel well Download the app,2020-04-16 08:03:51,en,0,0,1,0,True,positive,0.70095
121,1244378800818982913,['coronalockdown'],['https://twitter.com/i/web/status/1244378800818982913'],"‘You have sufficient funds for this, ensure no movement of migrant workers,’ Centre tells States

#CoronaLockdown

https://t.co/1KnLtEOG87 https://t.co/fkM7EiiSdD",You have sufficient funds for this ensure no movement of migrant workers Centre tells States CoronaLockdown,2020-03-29 21:40:00,en,1,2,10,38,True,weakly_positive,0.60115
122,1247816336178319361,"['covid', 'nhs']",['https://twitter.com/i/web/status/1247816336178319361'],"Anyone know of a resource tracking #COVID19 infections, fatalities among #NHS staff compared to the wider population? I wondered how much the staff levels are being depleted by the very disease they are in the front line fighting.",Anyone know of a resource tracking COVID infections fatalities among NHS staff compared to the wider population I wondered how much the staff levels are being depleted by the very disease they are in the front line fighting,2020-04-08 09:19:32,en,1,1,6,3,True,strongly_negative,0.12469999999999998
123,1249352776892780545,"['chromakey', 'lockdown', 'greenscreen', 'photos', 'videos']",['https://twitter.com/i/web/status/1249352776892780545'],"Explore #Chromakey during  #Lockdown. Use a simple #Greenscreen background to create amazing #photos and #Videos with #VFX effects. Try out #Chromavid App and spend fun time with #Kids.

#Corona #Coronavirus #Covid19 #homeideas #lockdown #socialdistancing #Stayhome https://t.co/AGTHsI6CIO",Explore Chromakey during Lockdown Use a simple Greenscreen background to create amazing photos and Videos with VFX effects Try out Chromavid App and spend fun time with Kids Corona Coronavirus Covid homeideas lockdown socialdistancing Stayhome,2020-04-12 15:04:48,en,0,0,0,0,True,strongly_positive,0.92405
124,1249469731993780225,['nhs'],['https://twitter.com/i/web/status/1249469731993780225'],Britain's #NHS is preparing to launch a contact-tracing app that can be used to tell other app-users if someone they’ve been physically near tests positive for #COVID19.,Britains NHS is preparing to launch a contacttracing app that can be used to tell other appusers if someone they ve been physically near tests positive for COVID,2020-04-12 22:49:32,en,0,0,0,0,True,positive,0.7787
125,1247455462452277248,['nhsvolunteerresponders'],['https://twitter.com/i/web/status/1247455462452277248'],"From today, thousands of #NHSVolunteerResponders will be able to report for duty to start supporting vulnerable people in our communities 🌟

If you’re waiting to hear back about your application, rest assured that you will by the end of the day!",From today thousands of NHSVolunteerResponders will be able to report for duty to start supporting vulnerable people in our communities If you re waiting to hear back about your application rest assured that you will by the end of the day,2020-04-07 09:25:33,en,4,15,27,88,True,positive,0.77115
126,1241717609449611267,"['covid', 'scotland']",['https://twitter.com/i/web/status/1241717609449611267'],Confirmed #covid19 cases in #Scotland regions as of yesterday. Data from @watty62  . Jupyter notebook available on github https://t.co/zSIVBETXEg (no rendering properly on git) https://t.co/X6V3WGsiri,Confirmed covid cases in Scotland regions as of yesterday Data from watty Jupyter notebook available on github no rendering properly on git,2020-03-22 13:25:22,en,0,0,1,1,True,weakly_negative,0.352
127,1249633364434272256,"['nhs', 'google', 'apple']",['https://twitter.com/i/web/status/1249633364434272256'],"The technology arm of #NHS has been working on a mobile phone app with #Google &amp; #Apple that the government hopes will help in ending the #COVID19 lockdown.
(Alert those who have the app if they have been in close proximity with someone who has been tested positive)

#Orwell1984",The technology arm of NHS has been working on a mobile phone app with Google amp Apple that the government hopes will help in ending the COVID lockdown Alert those who have the app if they have been in close proximity with someone who has been tested positive Orwell,2020-04-13 09:39:45,en,0,0,0,0,True,strongly_positive,0.9417
128,1243615535662804992,"['peoplehelpingpeople', 'coronalockdown']",['https://twitter.com/i/web/status/1243615535662804992'],Today only: last supper tapestry/wall hanging $40 paypal or cash app #PeopleHelpingPeople #CoronaLockdown #coronavirus #TwitterPhilanthropy #TwitterDoYourThing https://t.co/Vra4in7qsF,Today only last supper tapestrywall hanging paypal or cash app PeopleHelpingPeople CoronaLockdown coronavirus TwitterPhilanthropy TwitterDoYourThing,2020-03-27 19:07:03,en,0,0,0,0,True,neutral,0.5
129,1251572106346758145,"['askskynews', 'bame', 'vitamind', 'nhs']",['https://twitter.com/i/web/status/1251572106346758145'],#askskynews more evidence and data on #bame and #vitamind deficiency causing many #nhs unnecessary &amp; avoidable deaths https://t.co/xsrOulNQyH,askskynews more evidence and data on bame and vitamind deficiency causing many nhs unnecessary amp avoidable deaths,2020-04-18 18:03:37,en,0,0,0,0,True,neutral,0.5
130,1243982724987326464,['coronalockdown'],['https://twitter.com/i/web/status/1243982724987326464'],#CoronaLockdown: Los Angeles @MayorOfLA says the city is monitoring our traffic and cell phone data and plans to track down the people not following #coronavirus lockdown orders https://t.co/v2hjtfRFYi,CoronaLockdown Los Angeles MayorOfLA says the city is monitoring our traffic and cell phone data and plans to track down the people not following coronavirus lockdown orders,2020-03-28 19:26:08,en,4,4,15,13,True,neutral,0.5
131,1241262146559905792,"['nhs', 'selfhelp', 'covid']",[],Look after your mental health at this challenging time ! App is free to #nhs staff #selfhelp #Covid_19,Look after your mental health at this challenging time App is free to nhs staff selfhelp Covid,2020-03-21 07:15:31,en,0,0,2,4,True,strongly_positive,0.80935
132,1244708487403376640,"['nhs', 'volunteer', 'highbridge', 'somerset']",['https://twitter.com/i/web/status/1244708487403376640'],"Hi, I’m looking for a @GoodSamApp #NHS #volunteer to pick up a referral in the #Highbridge #Somerset area. Shopping request for a vulnerable 82 y/o adult. The details should be available to view on the App. Please get in touch if you are local. Thank you #responder #Covid_19",Hi I m looking for a GoodSamApp NHS volunteer to pick up a referral in the Highbridge Somerset area Shopping request for a vulnerable yo adult The details should be available to view on the App Please get in touch if you are local Thank you responder Covid,2020-03-30 19:30:03,en,0,0,0,0,True,positive,0.7202
133,1242544915600625666,"['nhs', 'coronavirus', 'nhsvolunteerresponders']",['https://twitter.com/i/web/status/1242544915600625666'],Can you help the #NHS NHS to keep those most vulnerable to #coronavirus safe and well? Join #NHSVolunteerResponders directly through this link: https://t.co/WoBZjh5LEn Please rt the link-can't join by downloading the app @wellbeingandy @ProfDonnaHall @benomsam @CdsPcn,Can you help the NHS NHS to keep those most vulnerable to coronavirus safe and well Join NHSVolunteerResponders directly through this link Please rt the linkcant join by downloading the app wellbeingandy ProfDonnaHall benomsam CdsPcn,2020-03-24 20:12:47,en,2,0,6,5,True,strongly_positive,0.94045
134,1244112042996322304,['outlander'],[],Don't miss a moment. Catch up on the latest episodes of #Outlander Season 5 now on the STARZ App.,Dont miss a moment Catch up on the latest episodes of Outlander Season now on the STARZ App,2020-03-29 04:00:00,en,29,113,202,2284,True,weakly_positive,0.5569500000000001
135,1244913283074842631,"['nhs', 'covid']",['https://twitter.com/i/web/status/1244913283074842631'],"@BenPBradshaw @mrjamesob It would help the #NHS if we all self-reported. Help slow the spread of #COVID19 and identify at risk cases by self-reporting your symptoms daily, even if you feel well. Get the app and tell your friends https://t.co/tNR3la6sFP

#NHSHeroes #coronavirusuk #CoronavirusLockdownUK",BenPBradshaw mrjamesob It would help the NHS if we all selfreported Help slow the spread of COVID and identify at risk cases by selfreporting your symptoms daily even if you feel well Get the app and tell your friends NHSHeroes coronavirusuk CoronavirusLockdownUK,2020-03-31 09:03:50,en,0,0,0,0,True,strongly_positive,0.9088
