,id_str,hashtags,urls,text,clean_text,created_at,lang,quote_count,reply_count,retweet_count,favorite_count,to_cache,sa_label,sa
0,1247218414218883073,"['book', 'smartphone']","['http://Taxi2Rail.com', 'https://twitter.com/i/web/status/1247218414218883073']",".Book now at https://t.co/sPbwkdB6H3 We have drivers waiting to respond. #Book from your #smartphone We understand how important it is to get around to criitical locations such as #grocery stores, #Medical and #pharmacy. #COVID19 #SafeAtHome @TwitterDC 🚖2⃣🚆❤️♿️⚕️🍎👍🏾",Book now at We have drivers waiting to respond Book from your smartphone We understand how important it is to get around to criitical locations such as grocery stores Medical and pharmacy COVID SafeAtHome TwitterDC,2020-04-06 17:43:36,en,0,0,0,0,True,weakly_positive,0.60115
1,1239591847921582081,"['covid', 'coronavirus', 'germs', 'smartphone', 'phone']",['http://bit.ly/2QjWUYu'],How to clean the bundle of germs that is your phone https://t.co/tzWVxj39Al via @APNews #covid19 #coronavirus #germs #smartphone #phone,How to clean the bundle of germs that is your phone via APNews covid coronavirus germs smartphone phone,2020-03-16 16:38:21,en,0,0,0,0,True,positive,0.70095
2,1251509941958897665,"['huawei', 'lockdown', 'samsung']",['https://2020innews.com/2020/04/18/oppo-find-x2-lite-listed-online-most-affordable-5g-smartphone-from-oppo/'],Update: Oppo Find X2 Lite Listed Online: Most Affordable 5G Smartphone From Oppo? #Huawei #Lockdown #Samsung https://t.co/EPWTj7ymcn,Update Oppo Find X Lite Listed Online Most Affordable G Smartphone From Oppo Huawei Lockdown Samsung,2020-04-18 13:56:36,en,0,0,0,0,True,neutral,0.5
3,1245115837972983808,"['free', 'evidencebased', 'covid']",['https://twitter.com/i/web/status/1245115837972983808'],"👏🏼👏🏽👏🏾👏🏿Yes!! We need more #FREE, high quality, #evidencebased resources available for #COVID19!  LMIC colleagues should have access to quality data without pay walls! @ACEP_IEM @SAEMonline @GEMAsocial @gemlrgroup",Yes We need more FREE high quality evidencebased resources available for COVID LMIC colleagues should have access to quality data without pay walls ACEPIEM SAEMonline GEMAsocial gemlrgroup,2020-03-31 22:28:43,en,0,0,2,3,True,strongly_positive,0.9043
4,1245035240365543424,"['quarantinelife', 'corona', 'covid']",[],Outrageous data usage this month #QuarantineLife #Corona #COVID19 https://t.co/4z8Qnrh39h,Outrageous data usage this month QuarantineLife Corona COVID,2020-03-31 17:08:27,en,0,0,0,0,True,negative,0.2706
5,1251509971705122816,"['smartphone', 'gesture', 'iot', 'keyboard', 'innovation', 'ai', 'ar']",['https://twitter.com/i/web/status/1251509971705122816'],"📱 #smartphone case doubles as a #Gesture-based #IoT device / #keyboard @IntEngineering #innovation #AI #AR #WearableTech #fintech #UX #IoT #tech 

@alvinfoo @DrJDrooghaag @ShiCooks @Julez_Norton @enricomolinari @Fabriziobustama @BOUTELOUPJP @Paula_Piccard @digitalcloudgal @AkwyZ https://t.co/R0EuO34IGJ",smartphone case doubles as a Gesturebased IoT device keyboard IntEngineering innovation AI AR WearableTech fintech UX IoT tech alvinfoo DrJDrooghaag ShiCooks JulezNorton enricomolinari Fabriziobustama BOUTELOUPJP PaulaPiccard digitalcloudgal AkwyZ,2020-04-18 13:56:43,en,0,1,17,11,True,weakly_positive,0.6909
6,1249115300483588096,"['mit', 'pact', 'bluetooth', 'smartphone', 'enable', 'covid', 'tracing']",['https://twitter.com/i/web/status/1249115300483588096'],#MIT #PACT Initiates #Bluetooth &amp; #Smartphone Tech to #Enable Anonymous #COVID19 Contact #Tracing https://t.co/vD65G3lM6g #contacttracing #healthcare #coronavirus,MIT PACT Initiates Bluetooth amp Smartphone Tech to Enable Anonymous COVID Contact Tracing contacttracing healthcare coronavirus,2020-04-11 23:21:09,en,0,0,0,0,True,neutral,0.5
7,1243969373917896707,"['covid', 'icu']",['https://twitter.com/i/web/status/1243969373917896707'],"Why NIV in #COVID19?
limited #ICU beds
lack of ventilators/trained staff
trial of NIV might be offered in hypoxemic resp failure/early #ARDS but carefully select pts + perform close monitoring/early re-assessment &amp; go for IMV if not improving
Antonelli M @ESICM #covidmarathon https://t.co/xKsRyge0kh",Why NIV in COVID limited ICU beds lack of ventilatorstrained staff trial of NIV might be offered in hypoxemic resp failureearly ARDS but carefully select pts perform close monitoringearly reassessment amp go for IMV if not improving Antonelli M ESICM covidmarathon,2020-03-28 18:33:05,en,0,5,25,58,True,negative,0.24080000000000001
8,1246648757795655685,"['coronavirus', 'outbreak', 'pandemic', 'trends', 'awareness']","['https://www.nytimes.com/interactive/2020/world/coronavirus-maps.html?campaign_id=9&emc=edit_NN_p_20200403&instance_id=17311&nl=morning-briefing&regi_id=118760861&section=topNe', 'https://lnkd.in/eY8WYfF']","#Coronavirus Map: Tracking the Global #Outbreak
#pandemic #trends #awareness

https://t.co/oUcMORTKJG... https://t.co/cBXHqEOpDA",Coronavirus Map Tracking the Global Outbreak pandemic trends awareness,2020-04-05 04:00:00,en,0,0,0,0,True,neutral,0.5
9,1248258883145129985,"['mhealth', 'hcsm', 'hcsmeu']",['https://ift.tt/3c2ytYa'],"Evergreen Life build COVID-19 heat map, new mental health app launched in UK, and many more https://t.co/qZTGscuCKA #mhealth #hcsm #hcsmeu",Evergreen Life build COVID heat map new mental health app launched in UK and many more mhealth hcsm hcsmeu,2020-04-09 14:38:03,en,0,0,0,0,True,weakly_positive,0.5640000000000001
10,1240287431083122688,"['socialcrediting', 'socialcontrol', 'smartphone']",[],FLIKKER OP! #SocialCrediting #SocialControl without #smartphone acces denied !!!,FLIKKER OP SocialCrediting SocialControl without smartphone acces denied,2020-03-18 14:42:21,en,0,0,0,0,True,weakly_positive,0.6706
11,1245721204046036995,"['stayhomesavelives', 'covid']",['https://www.nytimes.com/interactive/2020/04/02/us/coronavirus-social-distancing.html?fbclid=IwAR1VZ32nmMdOCxkuBBmfJSIF6CtcyD8zDPA9gqFgrEShOGz2KcqmoxeMYQA'],Cell phone data won't lie. People still travel more than 2 miles per day. #StayHomeSaveLives #COVID19   https://t.co/gIw2vGaRiM,Cell phone data wont lie People still travel more than miles per day StayHomeSaveLives COVID,2020-04-02 14:34:14,en,0,0,2,3,True,neutral,0.5
12,1247109430367395840,"['wearables', 'wearabletech']",['https://twitter.com/i/web/status/1247109430367395840'],Fitbit data shows increase in sleep time globally due to COVID-19 #wearables #wearabletech @fitbit https://t.co/qiI5EpOgSn https://t.co/IySwIoe95r,Fitbit data shows increase in sleep time globally due to COVID wearables wearabletech fitbit,2020-04-06 10:30:33,en,0,0,1,0,True,weakly_positive,0.6591
13,1241212942386900992,"['iot', 'ioht', 'mhealth', 'wearabletech', 'insurtech', 'fintech']",['https://twitter.com/i/web/status/1241212942386900992'],"Enabling Technologies for the Internet of Health Things

#IoT #IoHT #mhealth #wearabletech #insurtech #fintech #BigData @jblefevre60 @TunstallAsc @sallyeaves @pierrepinna @chboursin @insurtechforum @Xbond49 @mvollmer1 @HaroldSinnott @Paula_Piccard

https://t.co/uOStxtE8Qm",Enabling Technologies for the Internet of Health Things IoT IoHT mhealth wearabletech insurtech fintech BigData jblefevre TunstallAsc sallyeaves pierrepinna chboursin insurtechforum Xbond mvollmer HaroldSinnott PaulaPiccard,2020-03-21 04:00:00,en,0,0,0,0,True,neutral,0.5
14,1239982066399236099,"['stayhomesavelives', 'testkits']",['https://twitter.com/i/web/status/1239982066399236099'],"#StayHomeSaveLives day 3. My temp is 97.6° my husband’s temp is 97.5°. 
No #TestKits, no cure yet. Taking your temperature is a little thing you can do. Lots of data says that its very common in #Coronavirus cases to go from asymptomatic to a temperature of 103° in a day! https://t.co/4QczVDX1ux",StayHomeSaveLives day My temp is my husband s temp is No TestKits no cure yet Taking your temperature is a little thing you can do Lots of data says that its very common in Coronavirus cases to go from asymptomatic to a temperature of in a day,2020-03-17 18:28:57,en,1,29,22,142,True,weakly_negative,0.45985
15,1241093813357154304,['ventilator'],"['https://www.mtu.edu/unscripted/stories/2020/march/mtu-engineering-team-joins-opensource-ventilator-movement.html', 'https://twitter.com/i/web/status/1241093813357154304']",MTU Engineering Team Joins Open-source #Ventilator Movement @MichiganTech https://t.co/ICSAvcD6hW #VentilatorShortage #openaccess #openscience #opensource @opensourceway  #projectopenair @ElsevierConnect #CoronaCrisis #Covid_19 #Covid19InSA,MTU Engineering Team Joins Opensource Ventilator Movement MichiganTech VentilatorShortage openaccess openscience opensource opensourceway projectopenair ElsevierConnect CoronaCrisis Covid CovidInSA,2020-03-20 20:06:38,en,0,2,7,18,True,neutral,0.5
16,1250137000637861888,"['diy', 'covid', 'covid']","['https://buff.ly/2Qq6AAU', 'https://twitter.com/i/web/status/1250137000637861888']",Make a #DIY @micropython powered program to update #COVID19 data in real-time! https://t.co/LAUvODvRuI #COVIDー19 #Coronavirus #StayAtHomeStaySafe #StayHomeSaveLives #StayHome #StayAtHome #StayInsideStayInspired #StayInside #StayInspired #Programming @MakerfabsTech,Make a DIY micropython powered program to update COVID data in realtime COVIDー Coronavirus StayAtHomeStaySafe StayHomeSaveLives StayHome StayAtHome StayInsideStayInspired StayInside StayInspired Programming MakerfabsTech,2020-04-14 19:01:02,en,0,0,1,0,True,neutral,0.5
17,1245934207412637696,"['quarantinelife', 'quarantineandchill', 'reading', 'free', 'kindle']",['https://twitter.com/i/web/status/1245934207412637696'],#QuarantineLife got you down? #QuarantineAndChill by #Reading 'Fantastica Book One - Taerak'sVoid' #FREE on #Kindle https://t.co/E04Scn1STM (or app) The series is on #KindleUnlimited. #coronapocolypse  #COVID19Pandemic #coronavirus #freebooks #Book #freekindlebooks #freebies  #RT,QuarantineLife got you down QuarantineAndChill by Reading Fantastica Book One TaeraksVoid FREE on Kindle or app The series is on KindleUnlimited coronapocolypse COVIDPandemic coronavirus freebooks Book freekindlebooks freebies RT,2020-04-03 04:40:38,en,0,0,1,0,True,strongly_positive,0.8902
18,1245952078188630017,"['cameraphone', 'free', 'sharing', 'upload', 'video']","['http://tinyurl.com/t25v5ca', 'https://twitter.com/i/web/status/1245952078188630017']","Coronavirus Tracking Map Widget
Read More: https://t.co/M8zGFfrIDT
#cameraphone #free #sharing #upload #video #videophone https://t.co/vbMhRqBePa",Coronavirus Tracking Map Widget Read More cameraphone free sharing upload video videophone,2020-04-03 05:51:38,en,0,0,0,0,True,strongly_positive,0.8839
19,1250855809564753922,"['icu', 'covid']",['https://twitter.com/i/web/status/1250855809564753922'],More data showing highest viral load in lower compared to upper respiratory tract in #ICU patients with #COVID19 @ATSBlueEditor @ATSCritCare @SCCM,More data showing highest viral load in lower compared to upper respiratory tract in ICU patients with COVID ATSBlueEditor ATSCritCare SCCM,2020-04-16 18:37:19,en,0,0,1,3,True,weakly_negative,0.352
20,1244867435875815424,"['at', 'covid', 'outbreak']",['https://www.icvstech.com/blog/att-offering-extra-15gb-of-mobile-hotspot-data'],"#AT&amp;T is offering an additional 15GB of mobile data to keep people online during the #COVID19 #outbreak.

https://t.co/i23pem7YYf",ATampT is offering an additional GB of mobile data to keep people online during the COVID outbreak,2020-03-31 06:01:39,en,0,0,0,0,True,neutral,0.5
21,1242460217977307139,"['reading', 'covid']",['http://trbr.io/oTompaj'],Turning Your Smartphone Into An Ereader #reading #COVID19 https://t.co/aHQeAyKRgo via @marlowkelly1 https://t.co/daeR3H5R0n,Turning Your Smartphone Into An Ereader reading COVID via marlowkelly,2020-03-24 14:36:14,en,0,0,1,1,True,neutral,0.5
22,1251772387030417408,['huawei'],['https://twitter.com/i/web/status/1251772387030417408'],Canada needs to bar #huawei too. We do not need the Chinese government listening to every packet of data we send or receive from our phones. https://t.co/2cDrYLuG0u,Canada needs to bar huawei too We do not need the Chinese government listening to every packet of data we send or receive from our phones,2020-04-19 07:19:28,en,0,0,1,1,True,neutral,0.5
23,1244196740422602753,"['idlib', 'stayathomeandstaysafe', 'stayhome', 'covid']",['https://twitter.com/i/web/status/1244196740422602753'],"Voluntary stay at home/tent, yet forcibly under siege. 
#Idlib 
#StayAtHomeAndStaySafe 
#StayHome 
#Covid_19
#StayHome https://t.co/Sy27YokZUs",Voluntary stay at hometent yet forcibly under siege Idlib StayAtHomeAndStaySafe StayHome Covid StayHome,2020-03-29 09:36:33,en,0,0,0,0,True,neutral,0.5
24,1244028637155860480,"['covid', 'stayathomeandstaysafe']",[],"Day 10 of quarantine 
I finally realized freedom of movement is underrated 
#COVID19 
#StayAtHomeAndStaySafe https://t.co/s44jXye6ov",Day of quarantine I finally realized freedom of movement is underrated COVID StayAtHomeAndStaySafe,2020-03-28 22:28:34,en,0,0,0,0,True,strongly_positive,0.81845
25,1251405966320340992,"['epidemiology', 'china', 'selfisolation', 'quarantinelife']",['https://twitter.com/i/web/status/1251405966320340992'],"RACIAL TOLL OF VIRUS GROWS EVEN STARKER AS MORE DATA EMERGES
#Epidemiology #china 
 #selfisolation #QuarantineLife #Quarantine #covid19Canada #COVID2019 #COVIDIOT #COVIDBC #COVIDCanada #CoronavirusPandemic @corona
 #coronavirus #CoronavirusUSA 
https://t.co/kL1w4Qllma https://t.co/cd2OScOYrZ",RACIAL TOLL OF VIRUS GROWS EVEN STARKER AS MORE DATA EMERGES Epidemiology china selfisolation QuarantineLife Quarantine covidCanada COVID COVIDIOT COVIDBC COVIDCanada CoronavirusPandemic corona coronavirus CoronavirusUSA,2020-04-18 07:03:27,en,0,0,0,0,True,neutral,0.5
26,1242955050261020673,"['coronavirusoutbreak', 'hcsm']",[],This is so INTERESTING! A must watch. Tracking #CoronavirusOutbreak through @Kinsa #hcsm,This is so INTERESTING A must watch Tracking CoronavirusOutbreak through Kinsa hcsm,2020-03-25 23:22:31,en,0,0,0,0,True,strongly_positive,0.8302499999999999
27,1244190855319007232,"['lockdown', 'coronaupdate']",['https://twitter.com/i/web/status/1244190855319007232'],"14-Day Mandatory Quarantine For Lakhs Of Migrants Returning To UP, Bihar #Lockdown21 #CoronaUpdate
#coronavirusinindia

https://t.co/H7gZYxz1rO

Shared via NDTV News App (Android - https://t.co/kzEHqItExf | iPhone - https://t.co/S6eRtD6rUQ )",Day Mandatory Quarantine For Lakhs Of Migrants Returning To UP Bihar Lockdown CoronaUpdate coronavirusinindia Shared via NDTV News App Android iPhone,2020-03-29 09:13:10,en,0,0,1,0,True,positive,0.70095
28,1243215510616952833,['stayhomesavelives'],['https://twitter.com/i/web/status/1243215510616952833'],Our team at Downtown Santa Cruz is all together on this global movement: #StayHomeSaveLives in solidarity with frontline care givers fighting covid19. #StayHome so we can stay focused on critically ill patients. #FlattenTheCurve #kpcares https://t.co/MNu0drzodm,Our team at Downtown Santa Cruz is all together on this global movement StayHomeSaveLives in solidarity with frontline care givers fighting covid StayHome so we can stay focused on critically ill patients FlattenTheCurve kpcares,2020-03-26 16:37:30,en,3,2,10,31,True,strongly_positive,0.82985
29,1240012137612767232,"['tuesdaythoughts', 'flu', 'guns', 'us']",['https://twitter.com/i/web/status/1240012137612767232'],"#TuesdayThoughts

55,000 deaths this winter season from the #flu.

8,147 deaths from #Guns in the #US this year.

100 deaths in the #UnitedStates from #CoronavirusOutbreak. #COVID19

#TogetherAtHome #COVID2019 #Covid_19

Is #COVID a political tool? 

#Data #Election2020

#LTD",TuesdayThoughts deaths this winter season from the flu deaths from Guns in the US this year deaths in the UnitedStates from CoronavirusOutbreak COVID TogetherAtHome COVID Covid Is COVID a political tool Data Election LTD,2020-03-17 20:28:26,en,0,0,3,2,True,weakly_negative,0.30910000000000004
30,1240803066728730624,"['saferathome', 'stayhomesavelives']",['http://Coronavirus.LACity.org'],#saferathome new directive in LA -- limit all nonessential movement https://t.co/gSdaooVGcN #StayHomeSaveLives,saferathome new directive in LA limit all nonessential movement StayHomeSaveLives,2020-03-20 00:51:18,en,0,0,0,0,True,neutral,0.5
31,1247073912753737730,"['free', 'webinar', 'free', 'webinar']",['https://twitter.com/i/web/status/1247073912753737730'],"#Free #webinar: COVID-19 &amp; HR for the Voluntary Sector - 
Join us on Wednesday for our first #free #webinar for managers &amp; trustees of VCS organisations in Richmond &amp; Wandsworth boroughs.  Expert info, practical tips &amp; Q&amp;As.  Book now - https://t.co/L28IX6NivC   @LBRUT @wandbc",Free webinar COVID amp HR for the Voluntary Sector Join us on Wednesday for our first free webinar for managers amp trustees of VCS organisations in Richmond amp Wandsworth boroughs Expert info practical tips amp QampAs Book now LBRUT wandbc,2020-04-06 08:09:24,en,0,0,0,0,True,strongly_positive,0.9220999999999999
32,1250165000594956288,"['ventilator', 'covid', 'pakistan']",['https://twitter.com/i/web/status/1250165000594956288'],What’s the data for #ventilator use for #COVID19 in #Pakistan?  Doctors Move Away From Ventilators for COVID Patients ⁦@zfrmrza⁩ ⁦@tehminarehman1⁩  https://t.co/mGvoCcFI2i,What s the data for ventilator use for COVID in Pakistan Doctors Move Away From Ventilators for COVID Patients zfrmrza tehminarehman,2020-04-14 20:52:17,en,0,0,0,0,True,neutral,0.5
33,1245720256057937921,"['oneday', 'downloadnow', 'free', 'oneday', 'cloud']","['https://1daycloud.com/store', 'https://twitter.com/i/web/status/1245720256057937921']","How to run your business remotely easily with #OneDay ?
#downloadnow
#free

https://t.co/QE9EfkP6ka

#oneday #cloud #data #search #app #install #DigitalTransformation #smart #design #Automation #mobileapp #erp #management #remotework #coronavirus #nocode https://t.co/a3K9etTDst",How to run your business remotely easily with OneDay downloadnow free oneday cloud data search app install DigitalTransformation smart design Automation mobileapp erp management remotework coronavirus nocode,2020-04-02 14:30:28,en,0,0,1,2,True,strongly_positive,0.9063
34,1243447491661627392,['covidupdate'],['https://twitter.com/i/web/status/1243447491661627392'],"#Covid19Update. For 301 people tested for Coronavirus for two days in Uganda, only 4 people tested positive, President Museveni says efforts of identifying by temperature monitoring at the airport and quarantining and tracing the people interacted with returnees is working well https://t.co/1uTJC3joju",CovidUpdate For people tested for Coronavirus for two days in Uganda only people tested positive President Museveni says efforts of identifying by temperature monitoring at the airport and quarantining and tracing the people interacted with returnees is working well,2020-03-27 07:59:18,en,0,0,0,0,True,strongly_positive,0.8453999999999999
35,1248152649939083265,['dreamlab'],['https://twitter.com/i/web/status/1248152649939083265'],What if you could help fight COVID in your sleep? @VodafoneFdn's #DreamLab app will now be used to speed up @ImperialCollege's research on #coronavirus. See how you can help: https://t.co/92nZbPyyMh https://t.co/vxjAj7HQDY,What if you could help fight COVID in your sleep VodafoneFdns DreamLab app will now be used to speed up ImperialColleges research on coronavirus See how you can help,2020-04-09 07:35:55,en,0,0,0,0,True,positive,0.71075
36,1244554745538383872,"['belgium', 'icu']",['https://twitter.com/i/web/status/1244554745538383872'],Update #Belgium : Slowing down of #ICU is confirmed and SEIR model gives now extra days before saturation ! Compatible with the evolution of rescaled data on #covid19 cases. Being optimistic ! #StayAtHome https://t.co/1xGBRJV12T,Update Belgium Slowing down of ICU is confirmed and SEIR model gives now extra days before saturation Compatible with the evolution of rescaled data on covid cases Being optimistic StayAtHome,2020-03-30 09:19:08,en,15,26,103,290,True,weakly_positive,0.6591
37,1246932697588674566,"['stayathomeandstaysafe', 'socialdistancing', 'coronalockdown', 'coronavirus', 'covid']",['https://twitter.com/i/web/status/1246932697588674566'],#StayAtHomeAndStaySafe #SocialDistancing #CoronaLockdown #Coronavirus #COVID19 Check and listen now Today by Trace The Sidewalk @tracesidewalk on https://t.co/4zZsRPZYwX https://t.co/apuPoJjg75,StayAtHomeAndStaySafe SocialDistancing CoronaLockdown Coronavirus COVID Check and listen now Today by Trace The Sidewalk tracesidewalk on,2020-04-05 22:48:16,en,0,0,0,0,True,neutral,0.5
38,1246668520076668931,['newworldorder'],[],"Surveillance is In folks. If you had issues with privacy, well it's time. 

#NewWorldOrder",Surveillance is In folks If you had issues with privacy well its time NewWorldOrder,2020-04-05 05:18:31,en,0,0,0,0,True,weakly_positive,0.6366
39,1248746789190041600,"['coronavirus', 'coronaheroes']",['http://play.google.com/store/apps/details?id=com.rss.n.hindustantimes'],"Hindustan Times app download https://t.co/jRRPNGrVFv

 #coronavirus, #CoronaHeroes?

Share https://t.co/Mhqxtikezl",Hindustan Times app download coronavirus CoronaHeroes Share,2020-04-10 22:56:49,en,0,0,0,0,True,weakly_positive,0.648
40,1240088736190410757,"['quarantinelife', 'freebies']",['https://twitter.com/i/web/status/1240088736190410757'],"#QuarantineLife #freebies Get 'The Royal Dragoneers' - An award winning, dragon riding, troll fighting edge-of-your-seat-thrill ride! #FREE for ALL #Kindle and app users! https://t.co/wJ2xH0K8CX  #KindleUnlimited #coronapocolypse  #COVID19  #QuarantineAndChill #CoronavirusUSA #RT",QuarantineLife freebies Get The Royal Dragoneers An award winning dragon riding troll fighting edgeofyourseatthrill ride FREE for ALL Kindle and app users KindleUnlimited coronapocolypse COVID QuarantineAndChill CoronavirusUSA RT,2020-03-18 01:32:49,en,0,0,1,0,True,strongly_positive,0.95245
41,1244596575357358087,"['newworldorder', 'moha', 'somalia', 'ronaldo', 'covid', 'quarantine']","['https://play.google.com/store/apps/details?id=com.easyanp.easyanp', 'https://twitter.com/i/web/status/1244596575357358087']","https://t.co/SkHMX3i6kk
Download the app.
#NewWorldOrder #Moha #Somalia 
#Ronaldo #Covid_19 #Quarantine 
#AlexNaJalas #COVID19 #Betty
#ShameOnTangaTanga #lockdown #StaySafe #MondayMotivation #Zimbabwe #WhenCoronaVirusIsOver #QuarantineLife #Easyanp #WhenCoronaVirusIsOver https://t.co/lMpeqHNXBb",Download the app NewWorldOrder Moha Somalia Ronaldo Covid Quarantine AlexNaJalas COVID Betty ShameOnTangaTanga lockdown StaySafe MondayMotivation Zimbabwe WhenCoronaVirusIsOver QuarantineLife Easyanp WhenCoronaVirusIsOver,2020-03-30 12:05:21,en,0,0,0,0,True,neutral,0.5
42,1240495714138034178,"['huawei', 'huaweip']",['https://twitter.com/i/web/status/1240495714138034178'],"Chinese telecom giant #Huawei will launch its new #HuaweiP40 series on March 26 via online broadcast due to the #COVID19 pandemic.
https://t.co/3qun6IKSmT",Chinese telecom giant Huawei will launch its new HuaweiP series on March via online broadcast due to the COVID pandemic,2020-03-19 04:30:00,en,0,0,1,2,True,neutral,0.5
43,1248056452419330048,"['coronavirus', 'quarantinelife']",['https://twitter.com/i/web/status/1248056452419330048'],i gotta do something man! #coronavirus #QuarantineLife gonna have me big as a house when we finally can leave!!! 😆🤣😂🤦🏾‍♀️ shoutout to the #fightcamp creators for this workout app!!!,i gotta do something man coronavirus QuarantineLife gonna have me big as a house when we finally can leave shoutout to the fightcamp creators for this workout app,2020-04-09 01:13:40,en,0,0,0,0,True,weakly_negative,0.4742
44,1241551451874299904,"['smartphone', 'coronavirus', 'privacy']",['https://www.nbcnews.com/tech/tech-news/u-s-wants-smartphone-location-data-fight-coronavirus-privacy-advocates-n1162821'],"The U.S. wants #smartphone location data to fight #coronavirus. #Privacy advocates are worried.

https://t.co/wEK8jhxNwQ",The US wants smartphone location data to fight coronavirus Privacy advocates are worried,2020-03-22 02:25:07,en,0,0,0,0,True,negative,0.20705
45,1249070265717448707,"['free', 'app', 'typediabetes', 'share', 'learn', 'support', 'connect']",['https://twitter.com/i/web/status/1249070265717448707'],"@Healthline #free #app = T2DHealthline for people living w  #type2diabetes #share #learn #support #connect
Daily real-time #chats on #Food #nutrition #Medication #stress   
Impt to stay connected during these difficult times. https://t.co/HbZTq500bA #COVID19 #StayHome #StaySafe",Healthline free app TDHealthline for people living w typediabetes share learn support connect Daily realtime chats on Food nutrition Medication stress Impt to stay connected during these difficult times COVID StayHome StaySafe,2020-04-11 20:22:12,en,0,0,2,3,True,positive,0.7202
46,1243429514962554881,"['app', 'wearable', 'virus', 'outbreak', 'himss']",['https://twitter.com/i/web/status/1243429514962554881'],"#App-Based Study Using #Wearable Data to Predict #Virus #Outbreak

@msharmas @HCITExpert @hitconsultant

#HIMSS20 #HITsmIND #healthcare #coronavirus #COVID19 #mHealth #Apple #AppleWatch #PatientCare #PatientEngagement #Telehealth #Telemedicine #innovation

https://t.co/fCiaUkX5If",AppBased Study Using Wearable Data to Predict Virus Outbreak msharmas HCITExpert hitconsultant HIMSS HITsmIND healthcare coronavirus COVID mHealth Apple AppleWatch PatientCare PatientEngagement Telehealth Telemedicine innovation,2020-03-27 06:47:52,en,0,0,0,0,True,weakly_positive,0.6909
