,id_str,hashtags,urls,text,clean_text,created_at,lang,quote_count,reply_count,retweet_count,favorite_count,to_cache,sa_label,sa
284,1247077372991541249,['free'],['https://twitter.com/i/web/status/1247077372991541249'],"We are offering #FREE Data Collection tools to any Covid-19 Scientist or Researcher in any relevant field
Sign up today and join the worldwide effort.

#research #covid19 #coronavirus #datacollection #researcher #data #scientist #dataintelligence #science",We are offering FREE Data Collection tools to any Covid Scientist or Researcher in any relevant field Sign up today and join the worldwide effort research covid coronavirus datacollection researcher data scientist dataintelligence science,2020-04-06 08:23:09,en,0,0,0,0,True,strongly_positive,0.8689
285,1240006031201185795,"['confinementotal', 'quarantinelife', 'shutdowngermany']",['https://twitter.com/i/web/status/1240006031201185795'],"Coronavirus Outbreak Data Analysis 
Update: 03/17/2020 20:00 GMT
#Confinementotal #QuarantineLife #ShutDownGermany #QuedateEnLaCasa #ChineseVirus #workingfromhome #COVID19france #coronavirus https://t.co/2i3QsCKTbx",Coronavirus Outbreak Data Analysis Update GMT Confinementotal QuarantineLife ShutDownGermany QuedateEnLaCasa ChineseVirus workingfromhome COVIDfrance coronavirus,2020-03-17 20:04:10,en,0,0,0,0,True,neutral,0.5
286,1245813449818402817,"['batch', 'vancouver', 'smartphone']",['https://twitter.com/i/web/status/1245813449818402817'],"@Livnao, one of our #Batch9 startups based in #Vancouver, has #smartphone contact tracing technology to help track and control the spread of #COVID19. 

Read more about their work in #Canada here: https://t.co/UBUgZUPW1M",Livnao one of our Batch startups based in Vancouver has smartphone contact tracing technology to help track and control the spread of COVID Read more about their work in Canada here,2020-04-02 20:40:47,en,0,0,0,2,True,positive,0.70095
287,1247765963870593025,['stayathomeandstaysafe'],"['http://bit.ly/tiorrad3', 'https://twitter.com/i/web/status/1247765963870593025']",#StayAtHomeAndStaySafe This is music on https://t.co/4zZsRQhzov now Today by Trace The Sidewalk @tracesidewalk on https://t.co/C2Tndc5JIu #SocialDistancing #CoronaLockdown #Coronavirus #COVID19 https://t.co/WGukIkHv0T,StayAtHomeAndStaySafe This is music on now Today by Trace The Sidewalk tracesidewalk on SocialDistancing CoronaLockdown Coronavirus COVID,2020-04-08 05:59:22,en,0,0,0,0,True,neutral,0.5
288,1248169728893476865,"['stayathomeandstaysafe', 'quarantine', 'covid']",['https://twitter.com/i/web/status/1248169728893476865'],"#StayAtHomeAndStaySafe that if we all keep the #Quarantine #COVID19 in a short time it will only be history 

Send me a DM for your #free Pre-Registration in #Linkup #app @LinkupVe 
@linkupfounders 
@asameow18 
@bitcoin_clara 
@Linkup_ID 

@cctip_io airdrop 1000000 RICH 50 https://t.co/S1f4oaOvNC",StayAtHomeAndStaySafe that if we all keep the Quarantine COVID in a short time it will only be history Send me a DM for your free PreRegistration in Linkup app LinkupVe linkupfounders asameow bitcoinclara LinkupID cctipio airdrop RICH,2020-04-09 08:43:47,en,0,2,40,15,True,strongly_positive,0.9119999999999999
289,1245651210381606913,['carefulpakistan'],['https://twitter.com/i/web/status/1245651210381606913'],"#CarefulPakistan
@TeamForPakistan

The USTA is carefully monitoring the rapidly changing environment surrounding the COVID-19 pandemic, and is preparing for all contingencies.” https://t.co/MYD5mQ7xOV",CarefulPakistan TeamForPakistan The USTA is carefully monitoring the rapidly changing environment surrounding the COVID pandemic and is preparing for all contingencies,2020-04-02 09:56:06,en,0,0,1,0,True,weakly_positive,0.5640000000000001
290,1242434761563439108,"['socialdistancing', 'covid', 'teleworking']",['https://twitter.com/i/web/status/1242434761563439108'],With #socialdistancing being essential during #COVID19 #teleworking is becoming more prevalent. Know how to protect your personal and corporate devices and data by following the @cybercentre_ca’s advice:  https://t.co/jxH0Kezhi4 https://t.co/NHUOMDe9zd,With socialdistancing being essential during COVID teleworking is becoming more prevalent Know how to protect your personal and corporate devices and data by following the cybercentreca s advice,2020-03-24 12:55:05,en,0,0,8,6,True,weakly_positive,0.6909
291,1240839322208595968,"['quarantinelife', 'covid']",[],"If I run out of weed, does going to the pot shop qualify as “essential movement”?  #QuarantineLife #Covid_19",If I run out of weed does going to the pot shop qualify as essential movement QuarantineLife Covid,2020-03-20 03:15:22,en,0,0,0,0,True,neutral,0.5
292,1241285928104189952,"['géolocalisation', 'surveillance', 'smartphone']",['https://www.bbc.com/news/world-asia-51733145'],Coronavirus privacy : Are South Korea's alerts too revealing ? - BBC News https://t.co/G85pfjPagQ #géolocalisation #surveillance #smartphone,Coronavirus privacy Are South Koreas alerts too revealing BBC News géolocalisation surveillance smartphone,2020-03-21 08:50:01,en,0,0,0,0,True,neutral,0.5
293,1249679752799170561,"['future', 'smartphone']",['https://twitter.com/i/web/status/1249679752799170561'],"#Future is noe! futureproofn #smartphone Google unveils Maps, Search and YouTube features in India to help people combat coronavirus https://t.co/JO10H0q6yk",Future is noe futureproofn smartphone Google unveils Maps Search and YouTube features in India to help people combat coronavirus,2020-04-13 12:44:05,en,0,0,0,0,True,weakly_positive,0.5386
294,1243438049326817282,"['coronavirusoutbreak', 'covid', 'covidupdate']",[],"#CoronavirusOutbreak #COVID19 #COVID19Update 
Global data of Novel Corona virus, Covid19 as of 27 March https://t.co/7vzR6mg7j2",CoronavirusOutbreak COVID COVIDUpdate Global data of Novel Corona virus Covid as of March,2020-03-27 07:21:47,en,0,0,0,0,True,weakly_positive,0.6591
295,1242445819711819780,"['tuesdaythoughts', 'coronavirus']",['https://twitter.com/i/web/status/1242445819711819780'],"#TuesdayThoughts when your stuck at home due to the #Coronavirus we really don’t need to be going out, so instead of that, you can download our app for Free, and watch the magical Northern Lights Live  https://t.co/6zhIqn8xV4

https://t.co/JjTglkyEn5 https://t.co/YmGV285cbG",TuesdayThoughts when your stuck at home due to the Coronavirus we really don t need to be going out so instead of that you can download our app for Free and watch the magical Northern Lights Live,2020-03-24 13:39:01,en,1,0,8,54,True,weakly_positive,0.6591
296,1247320310812155904,"['vodafone', 'australia']","['https://www.miragenews.com/vodafone-supporting-customers-experiencing-financial-difficulties-due-to-covid-19/', 'https://twitter.com/i/web/status/1247320310812155904']","#Vodafone supporting customers experiencing financial difficulties due to ... 
https://t.co/PziHLZdNwc
#Australia #Business #Coronavirus #Covid19 #DebtCollection #Device #Employment #Government #Internet #Mobile #Tablet #Telco #Telecommunications #Unemployment #Voice #Website https://t.co/aREx1WERVQ",Vodafone supporting customers experiencing financial difficulties due to Australia Business Coronavirus Covid DebtCollection Device Employment Government Internet Mobile Tablet Telco Telecommunications Unemployment Voice Website,2020-04-07 00:28:30,en,0,0,0,0,True,weakly_negative,0.352
297,1244693648463278086,['ventilator'],['https://twitter.com/i/web/status/1244693648463278086'],"Statement against using one #Ventilator for multiple patients: - TV would go to the most compliant lung segments.
- Difficulty to manage PEEP. 
- Difficulty of monitoring vent alarms. #COVID19",Statement against using one Ventilator for multiple patients TV would go to the most compliant lung segments Difficulty to manage PEEP Difficulty of monitoring vent alarms COVID,2020-03-30 18:31:05,en,0,0,0,0,True,strongly_negative,0.1452
298,1247696006868652032,"['uk', 'paparazzi', 'icu', 'covid', 'privacy', 'fastrecovery']",[],How many hours will it be until the #UK #paparazzi leak @BorisJohnson photos from #ICU? #COVID19 #privacy  #fastrecovery,How many hours will it be until the UK paparazzi leak BorisJohnson photos from ICU COVID privacy fastrecovery,2020-04-08 01:21:23,en,0,0,0,0,True,weakly_negative,0.32999999999999996
299,1251104218422718465,"['samsung', 'galaxywatch']",['https://twitter.com/i/web/status/1251104218422718465'],"#Samsung's new Hand Wash 🙌 app prompts the #GalaxyWatch ⌚️ users to wash their hands frequently ⏱️. 
#SamsungHandWashApp #GalaxyHandWashApp #COVID19 #coronavirus #COVID19outbreak 
https://t.co/QRtW8afkLD",Samsungs new Hand Wash app prompts the GalaxyWatch users to wash their hands frequently SamsungHandWashApp GalaxyHandWashApp COVID coronavirus COVIDoutbreak,2020-04-17 11:04:24,en,0,0,0,0,True,positive,0.74695
300,1247220084420030464,"['teleworking', 'dataavailability']",['https://twitter.com/i/web/status/1247220084420030464'],"3Weeks #Teleworking #DataAvailability 4 SHI &amp; RN. 
-Slight decrease in RN Particulate due to RN01, RN03, RN13 not sending data for #Covid_19 related measures.
-REB released within 5 days during same period 
-Timely submission of RRRs 4both Particulate &amp; Noble Gas sustained @ 100% https://t.co/iQ7bEy9BFk",Weeks Teleworking DataAvailability SHI amp RN Slight decrease in RN Particulate due to RN RN RN not sending data for Covid related measures REB released within days during same period Timely submission of RRRs both Particulate amp Noble Gas sustained,2020-04-06 17:50:15,en,0,0,16,31,True,positive,0.7294
301,1245533528097320963,"['coronaupdate', 'stayathomeandstaysafe']",['https://twitter.com/i/web/status/1245533528097320963'],"#CoronaUpdate: ""More data showing people without symptoms are fueling the spread"" PLEASE #StayAtHomeAndStaySafe. Good night friends❤️
https://t.co/vXLck36qP6",CoronaUpdate More data showing people without symptoms are fueling the spread PLEASE StayAtHomeAndStaySafe Good night friends,2020-04-02 02:08:28,en,0,0,0,0,True,strongly_positive,0.92075
302,1248286254271086593,"['coronavirus', 'lockdown', 'quarantinelife']",['https://twitter.com/i/web/status/1248286254271086593'],"This #coronavirus #lockdown where the whole world is living a #QuarantineLife , and theres a chaos everywhere the college teachers on zoom app are like..... https://t.co/EjeAUuWP8w",This coronavirus lockdown where the whole world is living a QuarantineLife and theres a chaos everywhere the college teachers on zoom app are like,2020-04-09 16:26:49,en,0,0,0,0,True,weakly_negative,0.352
303,1242016507762098176,"['covid', 'workfromhome', 'jio']",['https://twitter.com/i/web/status/1242016507762098176'],"#COVID19 #WorkFromHome #Jio @reliancejio
I am a Jio consumer, residing at the heart of BBSR city, getting 80kbps(proudly 4G). Recently Jio announced double data on add-on recharges. What will I do with those data if I can't do my Office stuff efficiently? https://t.co/4qFikhtQSC",COVID WorkFromHome Jio reliancejio I am a Jio consumer residing at the heart of BBSR city getting kbpsproudly G Recently Jio announced double data on addon recharges What will I do with those data if I cant do my Office stuff efficiently,2020-03-23 09:13:05,en,0,0,0,0,True,positive,0.70095
304,1244137539323285504,"['coronavirus', 'covid', 'coronaupdate', 'coronavirusoutbreak']",['https://informationisbeautiful.net/visualizations/covid-19-coronavirus-infographic-datapack/'],"Important COVID-19 data.

 #CoronaVirus #COVID19 #CoronaUpdate #CoronavirusOutbreak  https://t.co/0bkJv5nxNn",Important COVID data CoronaVirus COVID CoronaUpdate CoronavirusOutbreak,2020-03-29 05:41:18,en,0,0,0,0,True,weakly_positive,0.60115
305,1242334641840893952,['jio'],['https://twitter.com/i/web/status/1242334641840893952'],"#Jio has Decided to Double high-speed 4G Data Plans.The company has decided to plan the double high-speed 4G data plans. Due to the #coronavirus, it is advised to work from home, so the company choose to plan the data internet plans. #harpalnews
https://t.co/W0QoQHCM8n",Jio has Decided to Double highspeed G Data PlansThe company has decided to plan the double highspeed G data plans Due to the coronavirus it is advised to work from home so the company choose to plan the data internet plans harpalnews,2020-03-24 06:17:14,en,0,0,0,0,True,neutral,0.5
306,1239742158468288512,"['quarantinelife', 'covid']",['https://twitter.com/i/web/status/1239742158468288512'],"Well, now that I'm in #QuarantineLife, I've been trying to read the data on the incubation period for #COVID19. Here's a preprint &amp; key figure (n=106, Wuhan): https://t.co/pdEGiB7AAC
Stats similar (n=181, outside Hubei): https://t.co/Ao4FgsoctF https://t.co/T6CHYrBEC2",Well now that Im in QuarantineLife Ive been trying to read the data on the incubation period for COVID Heres a preprint amp key figure n Wuhan Stats similar n outside Hubei,2020-03-17 02:35:38,en,0,0,0,0,True,weakly_positive,0.6366
307,1245244801492156422,"['film', 'media', 'smartphone', 'scotland']",['https://nofilmschool.com/corona-changes-tv-writing'],How is Coronavirus Changing TV Pilot and Staffing Season? #film #media #smartphone #scotland https://t.co/miI43Rm1pe,How is Coronavirus Changing TV Pilot and Staffing Season film media smartphone scotland,2020-04-01 07:01:10,en,0,0,0,0,True,neutral,0.5
308,1242203291196383233,['stayhomesavelives'],['https://twitter.com/i/web/status/1242203291196383233'],"Our @kpnorcal hospitals are joining in the global #StayHomeSaveLives movement in solidarity with front-line  care providers fighting COVID-19. With your help staying home, we can remain focused on caring for our critically-ill patients #StayHome #KPCares #FlattentheCurve https://t.co/nh4x0t4EJM",Our kpnorcal hospitals are joining in the global StayHomeSaveLives movement in solidarity with frontline care providers fighting COVID With your help staying home we can remain focused on caring for our criticallyill patients StayHome KPCares FlattentheCurve,2020-03-23 21:35:18,en,7,2,31,71,True,strongly_positive,0.9430000000000001
309,1245168087487467521,"['xiaomi', 'china', 'smartphone']","['https://u.fooo.ooo/post-21920/2020-3-31/Xiaomi-says-China-sales-are-close-to-a-full-recovery', 'https://twitter.com/i/web/status/1245168087487467521']",[🔴 NEWS] Xiaomi says China sales are close to a full recovery https://t.co/zDTLJ7rVp1 #Xiaomi #China #Smartphone #Renminbi #Coronavirus #Pandemic #CFO #ChiefFinancialOfficer #Mirror #Huawei #RockMusic #India #Europe,NEWS Xiaomi says China sales are close to a full recovery Xiaomi China Smartphone Renminbi Coronavirus Pandemic CFO ChiefFinancialOfficer Mirror Huawei RockMusic India Europe,2020-04-01 01:56:20,en,0,0,0,0,True,neutral,0.5
310,1245647107018510336,['carefulpakistan'],['https://twitter.com/i/web/status/1245647107018510336'],"#CarefulPakistan
@TeamForPakistan

Alvi told Pakistani wire service APP that he was visiting China to show solidarity with the people and the leadership of China while they were successfully fighting the coronavirus outbreak. https://t.co/QDHPCmajUC",CarefulPakistan TeamForPakistan Alvi told Pakistani wire service APP that he was visiting China to show solidarity with the people and the leadership of China while they were successfully fighting the coronavirus outbreak,2020-04-02 09:39:47,en,0,0,6,1,True,positive,0.7202
311,1251269205120385035,['ventilator'],['https://twitter.com/i/web/status/1251269205120385035'],"Great to see competitors come together to solve problems for the greater good. This #ventilator training app is a meaningful tool in our fight against #COVID19. #HelpingHeroes @HSELive @paulreiddublin @IMSTA_IRL @UK_ABHI @medtecheurope 
https://t.co/XuMPNgLa3R",Great to see competitors come together to solve problems for the greater good This ventilator training app is a meaningful tool in our fight against COVID HelpingHeroes HSELive paulreiddublin IMSTAIRL UKABHI medtecheurope,2020-04-17 22:00:00,en,0,0,1,4,True,strongly_positive,0.9037
312,1248331104559366144,"['quarantinelife', 'quarantine', 'lockdowncoronavirus']",['https://www.appcreator24.com/app952570'],"Download the COVID-19 Tracker App from the below link 
https://t.co/6QQr814VJT 
#QuarantineLife #Quarantine #LockdownCoronavirus",Download the COVID Tracker App from the below link QuarantineLife Quarantine LockdownCoronavirus,2020-04-09 19:25:02,en,0,0,0,0,True,neutral,0.5
313,1246862427108642818,"['covid', 'google', 'tracking', 'smartphone', 'gps', 'monitoring', 'gafa']",['https://twitter.com/i/web/status/1246862427108642818'],"Google fighting #Covid_19 by monitoring smartphone location 

#Google #Tracking #Smartphone #GPS #monitoring #GAFA 

 https://t.co/LuFvbnbKPf",Google fighting Covid by monitoring smartphone location Google Tracking Smartphone GPS monitoring GAFA,2020-04-05 18:09:02,en,0,0,0,0,True,weakly_negative,0.3194
314,1241172278219427841,"['iphone', 'applewatch', 'applepay']",['https://twitter.com/i/web/status/1241172278219427841'],A HUGE benefit of $AAPL’s #iPhone or #AppleWatch device and #ApplePay during this pandemic is that you don’t have to hand a credit card to anyone; you can pay via proximity without having to touch the probably-infected payment device’s screen. #COVID19,A HUGE benefit of AAPL s iPhone or AppleWatch device and ApplePay during this pandemic is that you don t have to hand a credit card to anyone you can pay via proximity without having to touch the probablyinfected payment device s screen COVID,2020-03-21 01:18:25,en,0,0,0,0,True,strongly_positive,0.9434
315,1245213814024474625,"['covidhospitals', 'covid', 'coronavirus', 'hospitals', 'covidlab']",['https://twitter.com/i/web/status/1245213814024474625'],Are you setting up #covidhospitals #COVIDー19 #coronavirus  @ccpvirus #hospitals #covidlab  you still have to ensure negative ventilation #pressure using #dps #dpsswitches and ensure #healthybreathableair with continuous #toxicgas #toxixvapour #toxicfumes monitoring systems https://t.co/8Ni7ZBKDLE,Are you setting up covidhospitals COVIDー coronavirus ccpvirus hospitals covidlab you still have to ensure negative ventilation pressure using dps dpsswitches and ensure healthybreathableair with continuous toxicgas toxixvapour toxicfumes monitoring systems,2020-04-01 04:58:02,en,0,0,3,3,True,weakly_negative,0.41105
316,1248460566932238338,"['huawei', 'covid']",['https://twitter.com/i/web/status/1248460566932238338'],"#Huawei contributes its tech to the Ministry of Health, @KKMPutrajaya to join Malaysia’s 🇲🇾 fight against #Covid19. The effectiveness of communication and data exchange is essential in screening for infected individuals and controlling the spread of infection. More to follow. https://t.co/duAUaZRTBz",Huawei contributes its tech to the Ministry of Health KKMPutrajaya to join Malaysia s fight against Covid The effectiveness of communication and data exchange is essential in screening for infected individuals and controlling the spread of infection More to follow,2020-04-10 03:59:29,en,0,1,1,2,True,negative,0.2213
317,1246166737797746688,"['coronaupdate', 'covid']",['https://twitter.com/i/web/status/1246166737797746688'],#CoronaUpdate for April 3: @caspiancenter is tracking the number of confirmed #COVID19 cases in the Greater #Caspian Region. Here are the latest numbers for today: https://t.co/VW6tkMqVUT,CoronaUpdate for April caspiancenter is tracking the number of confirmed COVID cases in the Greater Caspian Region Here are the latest numbers for today,2020-04-03 20:04:37,en,0,0,0,0,True,positive,0.71075
318,1250064704824905729,['tuesdaymotivation'],['https://twitter.com/i/web/status/1250064704824905729'],"#TuesdayMotivation brought to us by our own Sr. Principal Field Application Engineer, Ray Winkel! Giving back and doing his part through using technology! 
#COVID19 #MercuryMoments https://t.co/cFZtZA9O8V",TuesdayMotivation brought to us by our own Sr Principal Field Application Engineer Ray Winkel Giving back and doing his part through using technology COVID MercuryMoments,2020-04-14 14:13:45,en,0,0,1,0,True,weakly_positive,0.67
319,1249851840960835586,"['covid', 'icu']",['https://twitter.com/i/web/status/1249851840960835586'],"I completely agree with @MiscSusan - after taking care of patients with #COVID19 in the #ICU over the past few weeks, there is no question that COVID-19 causes #ARDS. Period. Read her excellent thread for more context &amp; data. @ATSCritCare @atsearlycareer @HarvardPulm @APSRapsr",I completely agree with MiscSusan after taking care of patients with COVID in the ICU over the past few weeks there is no question that COVID causes ARDS Period Read her excellent thread for more context amp data ATSCritCare atsearlycareer HarvardPulm APSRapsr,2020-04-14 00:07:54,en,0,0,0,0,True,strongly_positive,0.90865
320,1247562401026842625,"['covid', 'tuesdaythoughts', 'tuesdaythoughts', 'stayhome']",['https://twitter.com/i/web/status/1247562401026842625'],"#COVID19 #TuesdayThoughts #TuesdayThoughts #StayHome 
Did you know that many products like Pillsbury, General Mills, Anne's, Lysol, and even a few others count for Digital Box tops for Education? If you can I would consider downloading the app and helping a local school.",COVID TuesdayThoughts TuesdayThoughts StayHome Did you know that many products like Pillsbury General Mills Annes Lysol and even a few others count for Digital Box tops for Education If you can I would consider downloading the app and helping a local school,2020-04-07 16:30:29,en,0,0,0,0,True,strongly_positive,0.8953
321,1244951060814409729,['free'],['https://twitter.com/i/web/status/1244951060814409729'],"If u are not subscribing to @HowardStern on @SIRIUSXM ,now u can check out the show for #FREE on the app! It lets u even hear (&amp; see!!) some of the great celebrity interviews! With all of us staying home - #COVID19 - this is an awesome option to #binge on!! #Howard100 #Howard101",If u are not subscribing to HowardStern on SIRIUSXM now u can check out the show for FREE on the app It lets u even hear amp see some of the great celebrity interviews With all of us staying home COVID this is an awesome option to binge on Howard Howard,2020-03-31 11:33:57,en,0,0,0,0,True,strongly_positive,0.9611000000000001
322,1250746785242513409,"['free', 'lt']",['https://twitter.com/i/web/status/1250746785242513409'],"Episode 60: Apple and Google are Building an App and #Free Apple TV+
Listen, share, rate, and review!
#LT3 #CrazyTech #Apple #AppleTVPlus #AppleTV #Facebook #Google #Alphabet #Wing #Coronavirus #Covid19 #iPhone12 #Drone https://t.co/CCWkZmuKgK",Episode Apple and Google are Building an App and Free Apple TV Listen share rate and review LT CrazyTech Apple AppleTVPlus AppleTV Facebook Google Alphabet Wing Coronavirus Covid iPhone Drone,2020-04-16 11:24:06,en,0,0,0,0,True,strongly_positive,0.83525
323,1251798196965330944,"['togetherathome', 'coronaupdate']",['https://twitter.com/i/web/status/1251798196965330944'],"#TogetherAtHome 
#CoronaUpdate 
In the interstate movement the
Private cars can be allowed with passes if all are of same family members and movement is to hometown of either of spouses or work place.",TogetherAtHome CoronaUpdate In the interstate movement the Private cars can be allowed with passes if all are of same family members and movement is to hometown of either of spouses or work place,2020-04-19 09:02:02,en,0,0,0,0,True,neutral,0.5
324,1249658074975125511,"['dataprotection', 'covid', 'smartphone']",['https://medium.com/@mattjbartlett/covid-19-is-making-mass-surveillance-our-new-normal-a0d4c4e6b0ba'],Covid-19 Is Making Mass Surveillance Our New Normal #dataprotection #covid19 #smartphone https://t.co/UkINn4v3zp,Covid Is Making Mass Surveillance Our New Normal dataprotection covid smartphone,2020-04-13 11:17:57,en,0,0,1,0,True,neutral,0.5
325,1242329973433585664,"['auspol', 'tuesdaymotivation']",['https://twitter.com/i/web/status/1242329973433585664'],"#auspol 
#tuesdaymotivation 
Australia needs Public Servants to set up the new DIRECT VOTING DEMOCRACY system.
A phone app for all Citizens.
MARK you have proved to be loyal to the people. 
Please establish a trusted group. Labor has a few, the UNIONS many. Greens too.
MOVE!!",auspol tuesdaymotivation Australia needs Public Servants to set up the new DIRECT VOTING DEMOCRACY system A phone app for all Citizens MARK you have proved to be loyal to the people Please establish a trusted group Labor has a few the UNIONS many Greens too MOVE,2020-03-24 05:58:41,en,0,0,0,0,True,strongly_positive,0.9088
326,1247620970397007873,"['stayhomesavelives', 'covid']",[],So much movement Today !! Very Disappointing #StayHomeSaveLives #COVID19,So much movement Today Very Disappointing StayHomeSaveLives COVID,2020-04-07 20:23:13,en,0,0,0,0,True,negative,0.22935
327,1241318236391649281,['samsung'],['https://twitter.com/i/web/status/1241318236391649281'],"If you have a #Samsung Smart TV, go to the apps bit and download the Feratel Webcams app (it's free). Fantastic to waste a bit of time and look at almost live video of mountains, cities and stuff across Europe, in HD. It's really good. #Covid_19 #CoronaCrisis",If you have a Samsung Smart TV go to the apps bit and download the Feratel Webcams app its free Fantastic to waste a bit of time and look at almost live video of mountains cities and stuff across Europe in HD Its really good Covid CoronaCrisis,2020-03-21 10:58:24,en,0,0,0,0,True,strongly_positive,0.9374
